,name,rate,price
2401,هدست مخصوص بازی بلوتوثی جوی روم مدل SHG BLUETOOTH 3 HEADSET HL,-1,"۱,۸۷۹,۶۸۰"
2402,هدفون بلوتوثی جی بی ال مدل ZRE BEAM FORMING INDURANCE DIVE NEW IPX7,-1,"۴,۴۳۸,۴۳۰"
2403,هدفون بلوتوثی شیائومی مدل Xmi Basic,-1,"۱,۴۲۶,۶۲۰"
2404,هدفون بلوتوثی او ام تینگ مدل SSU AIR FREE 2021 EO002,-1,"۱,۵۳۱,۶۹۰"
2405,هدفون بلوتوثی هوآوی مدل THI GLOBAL NECKBAND FREELACE APTX,-1,"۲,۶۳۸,۰۰۰"
2406,هدست مخصوص بازی بلوتوثی وان مور مدل Piston Fit BT,-1,"۱,۵۸۳,۹۹۰"
2407,هدفون بلوتوثی آپاما مدل 369 A-1,۳.۱,"۲۸۵,۰۰۰"
2408,هدفون بلوتوثی او ام تینگ مدل ATN EO EAR 002 PHONE NEW,-1,"۱,۴۹۳,۶۶۰"
2409,هدست بلوتوثی باسئوس مدل NAS HEADPHONE SIMU S2 TRUE WIRLESS,-1,"۳,۴۳۶,۲۹۰"
2410,هدفون بلوتوثی مدل Truewire WK21,۳.۵,"۹۰۰,۰۰۰"
2411,هدست بلوتوثی ویوو مدل LANYARD PODS,۲,"۳۰۰,۰۰۰"
2412,هدفون بلوتوثی لنوو مدل EHM EARPHONE XT95 PRO 2022 BT,-1,"۱,۴۰۰,۰۸۰"
2413,هدست بلوتوثی باسئوس مدل  W04,-1,"۱,۲۷۶,۵۰۰"
2414,هدست بلوتوثی بروفون مدل BC20,۴,"۳۲۰,۰۰۰"
2415,هدفون بلوتوثی مدل RT-581 کد 002,۳.۷,"۱۸۹,۰۰۰"
2416,هدست بلوتوثی لنوو مدل YEI HEADPHONE TH10 SPORT GLOBAL,-1,"۱,۸۹۶,۰۰۰"
2417,هدفون بلوتوثی مدل AH805 طرح یونیکورن,-1,"۵۹۹,۰۰۰"
2418,هدفون مخصوص بازی بلوتوثی لنوو مدل LP80,-1,"۱,۱۵۹,۹۶۰"
2419,هدست بلوتوثی مدل P16-PLUS,-1,"۲۶۱,۰۰۰"
2420,هدست بلوتوثی یوسمز مدل US-IA04s,-1,"۱,۰۱۵,۰۰۰"
2421,هدفون بلوتوثی مدل AKZ MAX11,-1,"۸۵۹,۰۰۰"
2422,هدست بلوتوثی وان مور مدل MAH BLUETOOTH EHD90001TA BUDS,-1,"۵,۸۶۳,۰۰۰"
2423,هدفون بلوتوثی مدل 39_SPORT,-1,"۲۸۵,۰۰۰"
2424,هدست بلوتوثی یسیدو مدل ysp08,۴,"۷۲۷,۵۹۰"
2425,هدفون مخصوص بازی بلوتوثی لنوو مدل MOB EARHOOK LP50 True Wireless Earbuds,-1,"۲,۲۴۶,۷۹۰"
2426,هدفون بلوتوثی رپو مدل S120,-1,"۶۴۰,۰۰۰"
2427,هدست بلوتوثی اوی مدل A500Bl,-1,"۸۹۹,۰۰۰"
2428,هدفون بلوتوثی مدل A1,۱,"۳۱۵,۰۰۰"
2429,هدست مخصوص بازی بلوتوثی هوآوی مدل MDI GLOBALL FreeLace Wireless Earphone,-1,"۲,۳۸۷,۳۱۰"
2430,هدست مخصوص بازی بلوتوثی باسئوس مدل EMA STORM3 ACTIVE SBC 2022,-1,"۲,۸۴۱,۲۵۰"
2431,هدفون مخصوص بازی بلوتوثی لنوو مدل QE03,۲,"۹۱۹,۹۹۰"
2432,هدفون بلوتوثی مدل PR ROCK,۵,"۱,۵۵۰,۰۰۰"
2433,هدست بلوتوثی هایلو مدل kat t16 head seet,-1,"۲,۲۲۱,۸۰۰"
2434,هدفون بلوتوثی باسئوس مدل NRE EARPHONE W04 PRO TRUE WIRLESS,-1,"۲,۵۵۶,۹۷۰"
2435,هدفون بلوتوثی دیسون مدل D588,۳.۵,"۱۹۱,۰۰۰"
2436,هدست بلوتوثی لنوو مدل NTE HANG XT HOOK 83 PRO NEW,-1,"۱,۵۲۰,۰۰۰"
2437,هدست بلوتوثی می‌ آدیو مدل H6D,-1,"۱,۹۵۰,۰۰۰"
2438,هدفون مخصوص بازی بلوتوثی لنوو مدل FAR 02 GYQ 2021 GAME,۴,"۱,۷۹۲,۱۶۰"
2439,هدست مخصوص بازی بلوتوثی شیائومی مدل DIY NECKLACE GLOBAL NECKBAND BASIC 2021,-1,"۱,۵۳۹,۱۷۰"
2440,هدست بلوتوثی مدل pro4 30plus,-1,"۳۵۰,۰۰۰"
2441,هدست بلوتوثی آنر مدل HAM CHOCENEW ANC,-1,"۱,۹۶۹,۵۷۰"
2442,هدفون بلوتوثی جووی مدل SHO H163 52,۴,"۱,۴۸۸,۵۷۰"
2443,هدست بلوتوثی مدل E55BT,۳,"۳۶۰,۰۰۰"
2444,هدفون بلوتوثی لنوو مدل HAL EARBUDS HQ08 GLOBAL VERSION 2022,-1,"۱,۴۵۹,۴۲۰"
2445,هدفون بلوتوثی انستی مدل h003,-1,"۵۴۰,۰۰۰"
2446,هدفون بلوتوثی جووی مدل MEH H31 DO NEW,-1,"۱,۸۵۰,۰۰۰"
2447,هدست بلوتوثی باسئوس مدل EMD WM01 PLUS EARFPONE,-1,"۹۵۰,۰۰۰"
2448,هدفون بلوتوثی باسئوس مدل SHO ENCOK W2 AIR NORA REDUCTION,-1,"۲,۶۸۷,۰۰۰"
2449,هدفون بلوتوثی باسئوس مدل AK Earphone Bowie P1 BT,۲,"۸۴۰,۰۰۰"
2450,هدفون بلوتوثی مدل PT08,۴.۱,"۱,۲۸۰,۰۰۰"
2451,هدست بلوتوثی موکسوم مدل MX-WL34,۵,"۷۸۰,۰۰۰"
2452,هدفون بلوتوثی مدل AH-806C طرح تلفن,-1,"۶۳۰,۰۰۰"
2453,هدست بلوتوثی گرین مدل OSLO,-1,"۷۲۵,۰۰۰"
2454,هدفون بلوتوثی لنوو مدل HAM XT 95 PRO NEW,-1,"۱,۶۹۱,۶۲۰"
2455,هدست بلوتوثی وان مور مدل NRE EARBUDS PISTUNBUDS PRO 2022,-1,"۲,۹۶۹,۱۲۰"
2456,هدفون بلوتوثی شیائومی مدل ham earbuds neckband basic true,-1,"۱,۶۴۳,۱۲۰"
2457,هدست مخصوص بازی بلوتوثی جوی روم مدل SHG BLUETOOTH 3 HEADSET HL,-1,"۱,۸۷۹,۶۸۰"
2458,هدفون بلوتوثی لنوو مدل SAE XT89,-1,"۱,۴۷۳,۱۲۰"
2459,هدفون بلوتوثی هوارکو مدل FESTIVAL,۴,"۴۲۷,۰۰۰"
2460,هدفون بلوتوثی کی تی مدل RED CARPED,-1,"۴۲۷,۰۰۰"
2461,هدفون بلوتوثی کی تی مدل Flex3,۳.۸,"۳۵۴,۰۰۰"
2462,هدفون بلوتوثی جووی مدل MEH H31 DO NEW,-1,"۱,۸۵۰,۰۰۰"
2463,هدست بلوتوثی باسئوس مدل EMD WM01 PLUS EARFPONE,-1,"۹۵۰,۰۰۰"
2464,هدفون بلوتوثی باسئوس مدل SHO ENCOK W2 AIR NORA REDUCTION,-1,"۲,۶۸۷,۰۰۰"
2465,هدست بلوتوثی مدل T23,-1,"۶۲۰,۰۰۰"
2466,هدفون بلوتوثی باسئوس مدل MDI W04 GHKPO PRO GLOB,-1,"۱,۶۳۶,۱۸۰"
2467,هدفون بلوتوثی مدل AIR12D-phone,-1,"۸۹۸,۰۰۰"
2468,هدفون بلوتوثی مدل A66,۳,"۱۸۵,۰۰۰"
2469,هدفون بلوتوثی موکسوم مدل MX-WL01,۴,"۱,۳۵۰,۰۰۰"
2470,هدست بلوتوثی نیتو مدل 80,-1,"۴۰۰,۰۰۰"
2471,هدفون مخصوص بازی بلوتوثی شیائومی مدل RAG SPORT NECKBAND BASIC GLOBAL VERSION,-1,"۱,۶۳۶,۷۱۰"
2472,هدست بلوتوثی وان مور مدل ELH STEREOO COLORBUDS2 REDUCTION,-1,"۳,۴۲۸,۸۲۰"
2473,هدست بلوتوثی هایلو مدل NRE EARHOOK MORIPOD SPORT 2021,-1,"۱,۳۵۶,۳۶۰"
2474,هدفون بلوتوثی جی بی ال مدل SOK TUNE NEW 125 BT ADVANCE,-1,"۱,۵۵۶,۶۱۰"
2475,هدست بلوتوثی کینگ یو مدل H833,-1,"۳۹۹,۰۰۰"
2476,هدفون بلوتوثی مدل KE-01,۵,"۹۹۵,۰۰۰"
2477,هدست مخصوص بازی بلوتوثی آنر مدل THI WIRLESS GLOBAL CHOICE ULTRA,-1,"۱,۹۸۷,۰۰۰"
2478,هدست بلوتوثی جوی روم مدل JR-TL7,-1,"۱,۰۹۹,۰۰۰"
2479,هدفون بلوتوثی وان مور مدل DEH HIGH ANC PISTONBUDS PRO 2022,-1,"۲,۵۸۰,۵۲۰"
2480,هدفون بلوتوثی مدل 39_SPORT,-1,"۲۸۵,۰۰۰"
2481,هدست بلوتوثی یسیدو مدل ysp08,۴,"۷۲۷,۵۹۰"
2482,None,-1,-1
2483,None,-1,-1
2484,None,-1,-1
2485,None,-1,-1
2486,None,-1,-1
2487,None,-1,-1
2488,None,-1,-1
2489,None,-1,-1
2490,None,-1,-1
2491,None,-1,-1
2492,None,-1,-1
2493,None,-1,-1
2494,None,-1,-1
2495,None,-1,-1
2496,None,-1,-1
2497,None,-1,-1
2498,None,-1,-1
2499,None,-1,-1
2500,None,-1,-1
2501,None,-1,-1
2502,هدست بلوتوثی لنوو مدل ASE EARBUDS LP50 APTX 2022,-1,"۱,۹۸۴,۶۲۰"
2503,هدفون بلوتوثی باسئوس مدل HDI MELOBUDS W04 GLOBAL,-1,"۱,۵۸۰,۰۰۰"
2504,هدفون بلوتوثی مدل 39_SPORT,-1,"۲۸۵,۰۰۰"
2505,هدست بلوتوثی یسیدو مدل ysp08,۴,"۷۲۷,۵۹۰"
2506,هدفون بلوتوثی نوکیا مدل DIY BUDS E3101 GLOBAL WIRLESS,-1,"۱,۹۹۸,۰۰۰"
2507,هدفون بلوتوثی لنوو مدل NAS EARBUDS LP60 TWS WIRLEES,-1,"۱,۹۰۰,۰۰۰"
2508,هدفون بلوتوثی باسئوس مدل FTI HIGH QUALITY BOWIE E3 NEW,-1,"۲,۴۹۷,۰۰۰"
2509,هدست بلوتوثی مدل EMD TWS AIR 2 SE TRUE,۳.۳,"۱,۵۷۴,۴۱۰"
2510,هدست مخصوص بازی بلوتوثی باسئوس مدل EMA STORM3 ACTIVE SBC 2022,-1,"۲,۸۴۱,۲۵۰"
2511,هدست بلوتوثی هیتاگ مدل NBT-31,-1,"۳۰۰,۰۰۰"
2512,هدست بلوتوثی رسی مدل REP-W09,-1,"۵۷۰,۰۰۰"
2513,هدفون بلوتوثی دیسون مدل D588,۳.۵,"۱۹۱,۰۰۰"
2514,هدست مخصوص بازی بلوتوثی شیائومی مدل DIY NECKLACE GLOBAL NECKBAND BASIC 2021,-1,"۱,۵۳۹,۱۷۰"
2515,هدفون بلوتوثی مدل A1,۱,"۳۱۵,۰۰۰"
2516,هدست بلوتوثی اوی مدل A500Bl,-1,"۸۹۹,۰۰۰"
2517,هدست بلوتوثی ترانیو مدل T-H2,۲,"۴۴۰,۰۰۰"
2518,هدست بلوتوثی رپو مدل XS100,-1,"۱,۲۰۰,۰۰۰"
2519,هدست بلوتوثی هایلو مدل kat t16 head seet,-1,"۲,۲۲۱,۸۰۰"
2520,هدست مخصوص بازی بلوتوثی لنوو مدل RZA WIRLESS LP70 GLOBAL HANGIBNG,-1,"۲,۰۹۲,۴۴۰"
2521,هدفون بلوتوثی موکسوم مدل MX-WL52,-1,"۳۳۸,۴۰۰"
2522,هدفون بلوتوثی انستی مدل G04,۵,"۵۸۴,۰۰۰"
2523,هدفون بلوتوثی لی تاپ مدل BT06 کد 00595,۲.۵,"۳۱۰,۰۰۰"
2524,هدست بلوتوثی یوسمز مدل SY02-w,-1,"۱,۱۱۹,۰۰۰"
2525,هدست بلوتوثی باوین مدل 15,-1,"۹۲۰,۰۰۰"
2526,هدفون بلوتوثی مدل KE-01 طرح Rabbit,-1,"۹۹۵,۰۰۰"
2527,هدست بلوتوثی پاواریال مدل PA-BT35,-1,"۶۷۶,۸۰۰"
2528,هدفون بلوتوثی کیو سی وای مدل MEH 17 ZXSW 2121,-1,"۱,۳۰۶,۴۰۰"
2529,هدفون بلوتوثی او ام تینگ مدل SAE Omthing EO008,-1,"۱,۳۳۷,۱۹۰"
2530,هدفون بلوتوثی مدل air6 pro,۳.۳,"۳۷۳,۰۰۰"
2531,هدفون بلوتوثی لیتوو مدل L-7,-1,"۴۲۰,۰۰۰"
2532,هدفون بلوتوثی لنوو مدل SAE HT18ooth ndsfree,-1,"۱,۱۲۶,۰۷۰"
2533,هدست مخصوص بازی بلوتوثی وان مور مدل MHD ENC piston buds TWS 2022,-1,"۱,۴۸۶,۹۴۰"
2534,هدست بلوتوثی لنوو مدل YAM NEAK LACE th10SPORT,-1,"۱,۷۶۷,۵۴۰"
2535,هدفون بلوتوثی وان مور مدل HDI NECKBAND PISTON FIT REDUCTION GLOBAL,-1,"۱,۳۵۹,۹۶۰"
2536,هدست بلوتوثی لنوو مدل ELH BUDS LP3 PRO NEW,-1,"۱,۳۲۸,۰۰۰"
2537,هدست بلوتوثی مدل MRG30,-1,"۶۹۹,۰۰۰"
2538,هدست مخصوص بازی بلوتوثی اکسا مدل E3,۳.۷,"۷۲۰,۰۰۰"
2539,هدست مخصوص بازی بلوتوثی ریمکس مدل NTE HB HANGING 620 HEDSET,-1,"۱,۶۷۱,۶۷۰"
2540,هدست بلوتوثی مدل AKZ-K23,-1,"۸۰۰,۰۰۰"
2541,هدفون بلوتوثی باسئوس مدل POK BALANCE SIMU S2 NEW ANC PRO,-1,"۳,۴۳۶,۲۹۰"
2542,هدست بلوتوثی مچر مدل AS-MR-201,-1,"۴۰۰,۰۰۰"
2543,هدست مخصوص بازی بلوتوثی لنوو مدل HDI Bluetooth HD 300 Headphones,-1,"۱,۶۸۸,۹۵۰"
2544,هدست بلوتوثی موکسوم مدل MX-WL40,-1,"۶۸۰,۰۰۰"
2545,هدفون مخصوص بازی بلوتوثی لنوو مدل ZRF HT05 NEW FORMING,-1,"۹۷۸,۲۰۰"
2546,هدفون بلوتوثی جی جی بی وای مدل CA-022,-1,"۴۵۰,۰۰۰"
2547,هدفون بلوتوثی لنوو مدل MA REDMI LP6 IPTX,-1,"۱,۵۰۰,۰۰۰"
2548,هدست بلوتوثی لنوو مدل HDI HD200 EARPHON,-1,"۱,۵۴۴,۲۷۰"
2549,هدست بلوتوثی هایلو مدل NIB MELOBUDS GT5 HANGING 2021,-1,"۱,۴۳۲,۵۶۰"
2550,هدفون بلوتوثی گیبی مدل CA-018,-1,"۹۹۹,۰۰۰"
2551,هدست مخصوص بازی بلوتوثی شیائومی مدل EFA EDITION BUDS 3 SERIESS,-1,"۱,۷۶۱,۰۰۰"
2552,هدست مخصوص بازی بلوتوثی هایلو مدل EDI HEADPHON MORIPOD TRUE 2021,-1,"۱,۴۴۲,۰۰۰"
2553,هدفون بلوتوثی باسئوس مدل MDI W04 GHKPO PRO GLOB,-1,"۱,۶۳۶,۱۸۰"
2554,هدفون مخصوص بازی بلوتوثی شیائومی مدل RAG SPORT NECKBAND BASIC GLOBAL VERSION,-1,"۱,۶۳۶,۷۱۰"
2555,هدست مخصوص بازی بلوتوثی وان پلاس مدل ELH NECKBAND SWP Z GLO,-1,"۲,۴۵۴,۲۷۰"
2556,هدفون بلوتوثی مدل R-100,۳.۴,"۳۰۰,۰۰۰"
2557,هدست بلوتوثی کینگ یو مدل H833,-1,"۳۹۹,۰۰۰"
2558,هدفون بلوتوثی اکسون مدل E-S110,-1,"۲۹۹,۰۰۰"
2559,هدفون بلوتوثی مدل STN-26,-1,"۶۷۹,۰۰۰"
2560,هدست بلوتوثی وان مور مدل LHA EARPHONE COMFOBUDS 2 TRUE HANGING,-1,"۲,۴۸۴,۴۲۰"
2561,هدفون بلوتوثی مدل KE-01,۵,"۹۹۵,۰۰۰"
2562,هدست بلوتوثی مچر مدل AS-MR-217,-1,"۴۶۲,۰۰۰"
2563,هدست بلوتوثی توچی  مدل TC666,۴,"۳۱۲,۵۰۰"
2564,هدفون بلوتوثی سلبریت مدل A9,۴,"۵۲۰,۰۰۰"
2565,هدست بلوتوثی سلبریت مدل A16-2020,۳,"۴۹۰,۰۰۰"
2566,هدست بلوتوثی باسئوس مدل SP baseus simu s1 pro,-1,"۱,۸۵۰,۰۰۰"
2567,هدست بلوتوثی جرلکس مدل GH-05,۳,"۵۹۰,۰۰۰"
2568,هدفون بلوتوثی پرودو مدل PD-STWLEP001-BK,۴,"۴۰۷,۹۵۰"
2569,هدفون مخصوص بازی بلوتوثی شیائومی مدل NSS BASIK XDE 2022 NECKBAND,-1,"۱,۶۴۳,۸۳۰"
2570,هدست بلوتوثی باسئوس مدل MEH S2 EARPHONE SIMU Bluetooth,-1,"۲,۱۵۰,۰۰۰"
2571,هدست مخصوص بازی بلوتوثی لنوو مدل EFN HI FI HD 300 HEADSET,-1,"۲,۱۳۷,۰۰۰"
2572,هدفون بلوتوثی مدل QYS-9980,۳.۷,"۹۷۸,۲۳۰"
2573,هدفون بلوتوثی آپاما مدل A-2,۴,"۳۱۰,۰۰۰"
2574,هدست بلوتوثی موکسوم مدل MX-WL36,۱,"۲۳۷,۰۰۰"
2575,هدفون بلوتوثی باسئوس مدل HDI MELOBUDS W04 GLOBAL,-1,"۱,۵۸۰,۰۰۰"
2576,هدفون بلوتوثی مدل XY-800BT,-1,"۴۸۰,۰۰۰"
2577,هدست بلوتوثی مدل JM12,-1,"۶۳۸,۲۵۰"
2578,هدفون بلوتوثی باسئوس مدل dye redmi airnora conduction,-1,"۲,۳۵۰,۴۹۰"
2579,هدفون بلوتوثی لنوو مدل NAS EARBUDS LP60 TWS WIRLEES,-1,"۱,۹۰۰,۰۰۰"
2580,هدفون بلوتوثی نوکیا مدل DIY BUDS E3101 GLOBAL WIRLESS,-1,"۱,۹۹۸,۰۰۰"
2581,هدفون بلوتوثی باسئوس مدل FTI HIGH QUALITY BOWIE E3 NEW,-1,"۲,۴۹۷,۰۰۰"
2582,هدفون مخصوص بازی بلوتوثی شیائومی مدل NSS BASIK XDE 2022 NECKBAND,-1,"۱,۶۴۳,۸۳۰"
2583,هدفون بلوتوثی سلبریت مدل A9,۴,"۵۲۰,۰۰۰"
2584,هدست بلوتوثی سلبریت مدل A16-2020,۳,"۴۹۰,۰۰۰"
2585,هدست بلوتوثی باسئوس مدل SP baseus simu s1 pro,-1,"۱,۸۵۰,۰۰۰"
2586,هدست بلوتوثی جرلکس مدل GH-05,۳,"۵۹۰,۰۰۰"
2587,هدفون بلوتوثی گیبی مدل CA-018,-1,"۹۹۹,۰۰۰"
2588,هدفون بلوتوثی وان مور مدل HDI NECKBAND PISTON FIT REDUCTION GLOBAL,-1,"۱,۳۵۹,۹۶۰"
2589,هدست بلوتوثی لنوو مدل ELH BUDS LP3 PRO NEW,-1,"۱,۳۲۸,۰۰۰"
2590,هدفون بلوتوثی باسئوس مدل HDI MELOBUDS W04 GLOBAL,-1,"۱,۵۸۰,۰۰۰"
2591,هدفون بلوتوثی آپاما مدل A-2,۴,"۳۱۰,۰۰۰"
2592,هدست بلوتوثی موکسوم مدل MX-WL36,۱,"۲۳۷,۰۰۰"
2593,هدفون بلوتوثی لنوو مدل NAS EARBUDS LP60 TWS WIRLEES,-1,"۱,۹۰۰,۰۰۰"
2594,هدفون بلوتوثی نوکیا مدل DIY BUDS E3101 GLOBAL WIRLESS,-1,"۱,۹۹۸,۰۰۰"
2595,هدفون بلوتوثی باسئوس مدل FTI HIGH QUALITY BOWIE E3 NEW,-1,"۲,۴۹۷,۰۰۰"
2596,هدفون بلوتوثی مدل R-100,۳.۴,"۳۰۰,۰۰۰"
2597,هدست بلوتوثی لنوو مدل MRE XT82 TURE MELOBUDS,-1,"۱,۳۱۷,۵۴۰"
2598,هدفون بلوتوثی لنوو مدل ham over-ear h200 sport,-1,"۱,۵۹۸,۴۴۰"
2599,هدست بلوتوثی ترانیو مدل T-H2,۲,"۴۴۰,۰۰۰"
2600,هدست بلوتوثی رپو مدل XS100,-1,"۱,۲۰۰,۰۰۰"
2601,هدست مخصوص بازی بلوتوثی لنوو مدل RZA WIRLESS LP70 GLOBAL HANGIBNG,-1,"۲,۰۹۲,۴۴۰"
2602,هدفون بلوتوثی بروفون مدل B-O4,-1,"۳۳۷,۰۰۰"
2603,هدست مخصوص بازی بلوتوثی شیائومی مدل KAT neckband basic HI-FI,-1,"۱,۶۳۱,۶۳۰"
2604,هدفون بلوتوثی مدل Redmi AirDots J061LS,۲.۷,"۳۹۰,۰۰۰"
2605,هدست مخصوص بازی بلوتوثی باسئوس مدل SAG BUDS W3 GLOBAL EARBUDS,-1,"۱,۵۴۷,۷۱۰"
2606,هدفون بلوتوثی جوی روم مدل SHG GAMIN HL HIGH 2,-1,"۲,۳۷۸,۹۷۰"
2607,هدفون بلوتوثی لنوو مدل SAE Audífonos In-Ear Inalámbricos Lenovo LP11 Tws-Negro,۳,"۸۸۰,۰۰۰"
2608,هدست بلوتوثی ترانیو مدل MX2,۵,"۲۹۹,۹۰۰"
2609,هدفون بلوتوثی لنوو مدل SHO HEAD SEET XT85 HI-FI,-1,"۸۸۰,۰۰۰"
2610,هدفون بلوتوثی جوی روم مدل JR-TL9,-1,"۱,۲۰۰,۰۰۰"
2611,هدست مخصوص بازی بلوتوثی جووی مدل H163,-1,"۱,۶۵۰,۰۰۰"
2612,هدست بلوتوثی مدل k2,۱,"۲۳۰,۰۰۰"
2613,هدست مخصوص بازی بلوتوثی او ام تینگ مدل MAH Air free lace,-1,"۶۴۹,۷۰۰"
2614,هدفون مخصوص بازی بلوتوثی باسئوس مدل MPO EARBUDS WM01 PLUS ENC 2021,-1,"۱,۹۸۹,۸۵۰"
2615,هدست مخصوص بازی بلوتوثی جووی مدل FAT H31 QAZ,۵,"۲,۱۰۰,۰۰۰"
2616,هدفون بلوتوثی نوکیا مدل SOK YOUNG E3101 2022,-1,"۱,۸۰۰,۴۸۰"
2617,هدفون بلوتوثی مدل CAT EAR کد T23,-1,"۵۰۰,۰۰۰"
2618,هدست بلوتوثی وان مور مدل FTI NEW EARBUDS EHD9001TA WIRELEES,-1,"۵,۹۸۷,۰۰۰"
2619,هدفون بلوتوثی مدل AKZ-K24,-1,"۹۰۲,۰۰۰"
2620,هدست بلوتوثی لنوو مدل SSU EARBUDS HT38 NEW 21021,-1,"۱,۳۷۶,۸۳۰"
2621,هدفون بلوتوثی جی بی ال مدل ESN NACKBAND TUNE 125 BT HIGH QUALITY,-1,"۱,۴۶۱,۴۴۰"
2622,هدفون بلوتوثی جی بی ال مدل ESN NACKBAND TUNE 125 BT HIGH QUALITY,-1,"۱,۴۶۱,۴۴۰"
2623,هدفون بلوتوثی باسئوس مدل ELM IN EAR W04 VERSION 2022,-1,"۱,۴۹۴,۶۸۰"
2624,هدست بلوتوثی کیو سی وای مدل MRE HT01 AMBIENT AWARE NEW,-1,"۱,۸۴۹,۰۰۰"
2625,هدست بلوتوثی کیو سی وای مدل HSE HIGH Q T18 NEW 2022,-1,"۱,۱۸۵,۰۰۰"
2626,هدست مخصوص بازی بلوتوثی آنر مدل KOT VERSION NEW CHOIC GLOBAL,-1,"۱,۸۲۵,۵۹۰"
2627,هدفون بلوتوثی مدل R-100,۳.۴,"۳۰۰,۰۰۰"
2628,هدست بلوتوثی باسئوس مدل EHM BLUETOOTH W3 GLOBAL HANGING,-1,"۱,۴۴۰,۰۰۰"
2629,هدفون بلوتوثی موکسوم مدل MOX35,-1,"۷۲۰,۰۰۰"
2630,هدست بلوتوثی باسئوس مدل MO airnoraNEW,-1,"۲,۶۰۲,۰۰۰"
2631,هدست بلوتوثی هیتاگ مدل TWS-13,۲,"۴۲۹,۰۰۰"
2632,هدفون بلوتوثی لنوو مدل ham over-ear h200 sport,-1,"۱,۵۹۸,۴۴۰"
2633,هدست بلوتوثی دبلیو کی مدل P5,-1,"۲۸۴,۲۰۰"
2634,هدفون بلوتوثی کیو سی وای مدل NSH HANDS FREE T18 GLOBAL LOW LATENCY,-1,"۱,۱۳۵,۰۰۰"
2635,هدفون بلوتوثی باسئوس مدل NAS EARBUDS W11 ENC 2022,-1,"۲,۴۷۶,۸۷۰"
2636,هدست مخصوص بازی بلوتوثی لنوو مدل SSU MG5 NEW GAMING,-1,"۱,۴۶۸,۴۷۰"
2637,هدست مخصوص بازی بلوتوثی نوکیا مدل SEP ESSENTIAL E3101 EARPHONE,-1,"۱,۷۸۹,۹۷۰"
2638,هدست بلوتوثی وان مور مدل MAN COMFOBUDS STEREOO PRO POP UP,-1,"۳,۸۹۹,۹۹۰"
2639,هدست مخصوص بازی بلوتوثی لنوو مدل ZRE ANC SERIES XT81 SEMI IN EAR,-1,"۷۲۸,۰۰۰"
2640,هدست بلوتوثی لنوو مدل MRE H15 POP UP BUDS,-1,"۱,۹۹۷,۰۰۰"
2641,هدفون بلوتوثی لنوو مدل SAE Sports Earpne,۲.۵,"۸۹۹,۹۹۰"
2642,هدست بلوتوثی مچر مدل AS-MR-201,-1,"۴۰۰,۰۰۰"
2643,هدفون بلوتوثی لنوو مدل SAE Audífonos In-Ear Inalámbricos Lenovo LP11 Tws-Negro,۳,"۸۸۰,۰۰۰"
2644,هدفون بلوتوثی سلبریت مدل A9,۴,"۵۲۰,۰۰۰"
2645,هدست بلوتوثی سلبریت مدل A16-2020,۳,"۴۹۰,۰۰۰"
2646,هدست بلوتوثی باسئوس مدل SP baseus simu s1 pro,-1,"۱,۸۵۰,۰۰۰"
2647,هدست بلوتوثی لنوو مدل HDI HD200 EARPHON,-1,"۱,۵۴۴,۲۷۰"
2648,هدست بلوتوثی جرلکس مدل GH-05,۳,"۵۹۰,۰۰۰"
2649,هدفون بلوتوثی گیبی مدل CA-018,-1,"۹۹۹,۰۰۰"
2650,هدفون بلوتوثی نوکیا مدل SOK YOUNG E3101 2022,-1,"۱,۸۰۰,۴۸۰"
2651,هدفون بلوتوثی آپاما مدل A-2,۴,"۳۱۰,۰۰۰"
2652,هدست بلوتوثی موکسوم مدل MX-WL36,۱,"۲۳۷,۰۰۰"
2653,هدست مخصوص بازی بلوتوثی او ام تینگ مدل MAH Air free lace,-1,"۶۴۹,۷۰۰"
2654,هدفون مخصوص بازی بلوتوثی باسئوس مدل MPO EARBUDS WM01 PLUS ENC 2021,-1,"۱,۹۸۹,۸۵۰"
2655,هدفون بلوتوثی مدل AKZ-K24,-1,"۹۰۲,۰۰۰"
2656,هدست بلوتوثی لنوو مدل HDI NEW XT96 EARPHONE,-1,"۱,۱۴۶,۰۰۰"
2657,هدست مخصوص بازی بلوتوثی جووی مدل FAT H31 QAZ,۵,"۲,۱۰۰,۰۰۰"
2658,هدست مخصوص بازی بلوتوثی لنوو مدل HSN GLOBAL POWER PLANT QT81 HEADPHONE,-1,"۱,۳۰۲,۰۷۰"
2659,هدفون بلوتوثی مدل R-100,۳.۴,"۳۰۰,۰۰۰"
2660,هدفون مخصوص بازی بلوتوثی لنوو مدل ADI HIGH GAMING XG01 2022,-1,"۱,۸۹۶,۰۰۰"
2661,هدست مخصوص بازی بلوتوثی اوی مدل MAH A799 BL,-1,"۸۸۰,۰۰۰"
2662,هدفون بلوتوثی مدل M1,۱,"۵۸۹,۰۰۰"
2663,هدفون بلوتوثی موکسوم مدل LEATHER - XBASS,-1,"۵۲۶,۰۰۰"
2664,هدفون بلوتوثی مدل VJ084 طرح METAL,-1,"۸۰۰,۰۰۰"
2665,هدست بلوتوثی پاواریال مدل PA-BT75,-1,"۷۵۶,۷۰۰"
2666,هدست بلوتوثی لنوو مدل SUR LP60 STEREOO ANC,-1,"۲,۳۴۶,۰۰۰"
2667,هدفون بلوتوثی نوکیا مدل SOK YOUNG E3101 2022,-1,"۱,۸۰۰,۴۸۰"
2668,هدفون بلوتوثی باسئوس مدل RKI HEADSET BOWIE E2 EDITIONAL,-1,"۲,۲۰۲,۷۵۰"
2669,هدست بلوتوثی لنوو مدل SIR 12 NEW BUDS H,-1,"۸۱۲,۵۰۰"
2670,هدفون بلوتوثی مدل AKZ-K24,-1,"۹۰۲,۰۰۰"
2671,هدفون بلوتوثی مدل R-100,۳.۴,"۳۰۰,۰۰۰"
2672,هدست مخصوص بازی بلوتوثی لنوو مدل HSN GLOBAL POWER PLANT QT81 HEADPHONE,-1,"۱,۳۰۲,۰۷۰"
2673,هدست بلوتوثی لنوو مدل MPO BLUETOOTH LP5 TWS,-1,"۱,۷۹۶,۰۰۰"
2674,هدست بلوتوثی مدل MH6,-1,"۷۰۰,۰۰۰"
2675,هدست مخصوص بازی بلوتوثی فنتک مدل WH01,-1,"۲,۶۲۳,۰۰۰"
2676,هدفون مخصوص بازی بلوتوثی لنوو مدل MID EARHOOK HD300 GLOBAL GAMING,-1,"۱,۹۹۸,۰۰۰"
2677,هدست بلوتوثی لنوو مدل MRE H15 POP UP BUDS,-1,"۱,۹۹۷,۰۰۰"
2678,هدفون بلوتوثی لنوو مدل SAE Sports Earpne,۲.۵,"۸۹۹,۹۹۰"
2679,هدست بلوتوثی جی بی ال مدل E560,۱,"۳۶۰,۰۰۰"
2680,هدفون بلوتوثی لنوو مدل SAE QT NBV 81,-1,"۱,۲۸۰,۵۴۰"
2681,هدفون بلوتوثی هویت مدل i39,۴,"۴۱۰,۰۰۰"
2682,هدست بلوتوثی رومن مدل BH10,-1,"۲۵۰,۰۰۰"
2683,هدفون بلوتوثی مدل M-100,۴,"۴۱۹,۰۰۰"
2684,هدفون بلوتوثی مدل M1,۱,"۵۸۹,۰۰۰"
2685,هدفون بلوتوثی موکسوم مدل LEATHER - XBASS,-1,"۵۲۶,۰۰۰"
2686,هدفون بلوتوثی گیبی مدل CA-018,-1,"۹۹۹,۰۰۰"
2687,هدفون بلوتوثی نوکیا مدل SOK YOUNG E3101 2022,-1,"۱,۸۰۰,۴۸۰"
2688,هدست بلوتوثی پاواریال مدل PA-BT75,-1,"۷۵۶,۷۰۰"
2689,هدفون بلوتوثی مدل AKZ-K24,-1,"۹۰۲,۰۰۰"
2690,هدست بلوتوثی مدل MH6,-1,"۷۰۰,۰۰۰"
2691,هدست مخصوص بازی بلوتوثی لنوو مدل HSN GLOBAL POWER PLANT QT81 HEADPHONE,-1,"۱,۳۰۲,۰۷۰"
2692,هدست بلوتوثی لنوو مدل HDI NEW XT96 EARPHONE,-1,"۱,۱۴۶,۰۰۰"
2693,هدفون بلوتوثی مدل R-100,۳.۴,"۳۰۰,۰۰۰"
2694,هدست بلوتوثی لنوو مدل MPO BLUETOOTH LP5 TWS,-1,"۱,۷۹۶,۰۰۰"
2695,هدست مخصوص بازی بلوتوثی فنتک مدل WH01,-1,"۲,۶۲۳,۰۰۰"
2696,هدفون مخصوص بازی بلوتوثی لنوو مدل MID EARHOOK HD300 GLOBAL GAMING,-1,"۱,۹۹۸,۰۰۰"
2697,هدفون مخصوص بازی بلوتوثی لنوو مدل ADI HIGH GAMING XG01 2022,-1,"۱,۸۹۶,۰۰۰"
2698,هدست مخصوص بازی بلوتوثی اوی مدل MAH A799 BL,-1,"۸۸۰,۰۰۰"
2699,هدست بلوتوثی پاواریال مدل PA-BT78,-1,"۶۴۷,۶۶۰"
2700,هدست بلوتوثی مدل Air 2 SE 2021,۴.۵,"۵۹۰,۰۰۰"
2701,هدفون بلوتوثی مدل XB230,-1,"۴۰۰,۰۰۰"
2702,None,-1,-1
2703,None,-1,-1
2704,None,-1,-1
2705,None,-1,-1
2706,None,-1,-1
2707,None,-1,-1
2708,None,-1,-1
2709,None,-1,-1
2710,None,-1,-1
2711,None,-1,-1
2712,None,-1,-1
2713,None,-1,-1
2714,None,-1,-1
2715,None,-1,-1
2716,None,-1,-1
2717,None,-1,-1
2718,None,-1,-1
2719,None,-1,-1
2720,None,-1,-1
2721,None,-1,-1
2722,هدفون بلوتوثی پدمیت مدل T3 PLUS,۴.۴,"۱,۲۸۰,۰۰۰"
2723,هدفون بلوتوثی مدل AKZ-K24,-1,"۹۰۲,۰۰۰"
2724,هدفون بلوتوثی لنوو مدل SAE QT NBV 81,-1,"۱,۲۸۰,۵۴۰"
2725,هدست مخصوص بازی بلوتوثی لنوو مدل HSN GLOBAL POWER PLANT QT81 HEADPHONE,-1,"۱,۳۰۲,۰۷۰"
