,name,rate,price
0,هندزفری بلوتوثی مدل  inpods 12,۳.۹,"۱۲۵,۰۰۰"
1,هندزفری بلوتوثی مدل BTH-F9-5,۳.۹,"۲۱۹,۸۰۰"
2,هدفون بی سیم مدل InPods Proi,-1,"۴۸۵,۰۰۰"
3,هدست بلوتوثی مدل inpods Pro,-1,"۴۲۵,۰۰۰"
4,هندزفری بلوتوثی لیتو مدل LT7,۳.۸,"۸۹۵,۰۰۰"
5,هندزفری بلوتوثی مدل M10,۴,"۲۲۸,۰۰۰"
6,هندزفری بلوتوثی شیائومی مدل Redmi Buds 3 Lite Global Pack,۳.۹,"۷۵۳,۰۰۰"
7,هندزفری بلوتوثی کلومن مدل K - G185,۳.۴,"۳۹۹,۰۰۰"
8,هندزفری بلوتوثی مدل XY-30,۳.۸,"۶۹۹,۰۰۰"
9,هندزفری بلوتوثی هایلو مدل GT6,۴.۲,"۵۷۹,۰۰۰"
10,هندزفری بلوتوثی  مدل inpods 3,۳.۹,"۴۲۵,۰۰۰"
11,هندزفری بلوتوثی لیتو مدل LT6,۳.۴,"۷۹۵,۰۰۰"
12,هندزفری بلوتوثی کیو سی وای مدل T17,۴.۳,"۴۶۹,۰۰۰"
13,هندزفری بلوتوثی مدل ایرپاد 2,۳.۹,"۴۶۰,۱۷۰"
14,هندزفری بلوتوثی شیائومی مدل Pro35.2,۲.۷,"۳۶۹,۰۰۰"
15,هندزفری بلوتوثی لیتو مدل LB-8,۴,"۵۹۵,۰۰۰"
16,هندزفری بلوتوثی مدل ایرپاد پرو3,۲.۶,"۳۹۶,۲۰۰"
17,هندزفری بلوتوثی مدل K24,۴.۳,"۶۱۷,۰۰۰"
18,هندزفری بلوتوثی اکسیژن مدل B3,۴.۱,"۱۹۷,۰۰۰"
19,هندزفری بلوتوثی لیتو مدل LT-15,۳.۵,"۹۹۵,۰۰۰"
20,هندزفری بلوتوثی لنوو مدل QE03,۴,"۱۵۳,۰۰۰"
21,هندزفری بلوتوثی مدل i7,۳.۳,"۵۸,۹۰۰"
22,هندزفری بلوتوثی لنوو مدل New QT-81,۳.۷,"۵۴۵,۰۰۰"
23,هندزفری بلوتوثی لنوو مدل HQ08,۴,"۶۷۰,۰۱۰"
24,هندزفری بلوتوثی هایلو مدل GT7 Neo,۳,"۹۱۱,۳۹۰"
25,هندزفری بلوتوثی شیائومی مدل buds 3,۳.۹,"۱,۰۰۰,۰۰۰"
26,هندزفری بلوتوثی کلومن مدل BK - G255,۴.۲,"۵۹۹,۰۰۰"
27,هندزفری بلوتوثی رسی مدل REP-W48,۴.۳,"۱,۴۵۲,۰۰۰"
28,هندزفری بلوتوثی مدل i7,۳.۳,"۵۸,۹۰۰"
29,هندزفری بلوتوثی لنوو مدل NECkBAND HE05,۴,"۱۳۰,۰۰۰"
30,هندزفری بلوتوثی مدل M10 V5.1,۳.۸,"۲۲۷,۵۰۰"
31,هندزفری بلوتوثی کلومن پلاس مدل +K-TW2,-1,"۱,۴۵۰,۰۰۰"
32,هندزفری بلوتوثی شیائومی مدل Airdots pro,۱.۶,"۳۷۳,۵۱۰"
33,هندزفری بلوتوثی انکر مدل Soundcore R100,۴.۲,"۱,۱۵۰,۰۰۰"
34,هندزفری بلوتوثی شیائومی مدل Air 2S,۳.۵,"۱,۵۵۰,۰۰۰"
35,هندزفری بلوتوثی وان مور مدل ComfoBuds Pro ES901,۴.۱,"۱,۸۶۵,۷۴۰"
36,هندزفری بلوتوثی شیائومی مدل FAR EARPHONE NECBAND BASIC TWS BT,۴.۵,"۱,۰۷۰,۰۰۰"
37,هندزفری بلوتوثی شیائومی مدل Air 2 Pro,۴.۴,"۲,۵۵۰,۰۰۰"
38,هندزفری بلوتوثی بنگ اند آلفسن مدل BeoSound EQ,-1,"۲۴,۰۰۰,۰۰۰"
39,هندزفری بلوتوثی کیو سی وای مدل HT03,۴.۱,"۸۵۹,۰۰۰"
40,هندزفری بلوتوثی مدل pro6,۴.۲,"۲۰۸,۰۰۰"
41,هندزفری بلوتوثی شیائومی مدل Airdotspro0.5,۱,"۳۸۳,۰۰۰"
42,هندزفری بلوتوثی شیائومی مدل Air 2S,۳.۵,"۱,۵۵۰,۰۰۰"
43,هندزفری بلوتوثی لنوو مدل XE05 Light,۴.۱,"۲۸۵,۰۰۰"
44,هندزفری بلوتوثی شیائومی مدل Air 2 Pro,۴.۴,"۲,۵۵۰,۰۰۰"
45,هندزفری بلوتوثی هایلو مدل MEH BLUETOTH GT7 SERIESS,۴.۵,"۹۳۱,۰۰۰"
46,هندزفری بلوتوثی مدل pro6,۴.۲,"۲۰۸,۰۰۰"
47,هندزفری بلوتوثی شیائومی مدل SOK AIR ADF DOST3 2022,۲.۹,"۶۵۰,۰۰۰"
48,هندزفری بلوتوثی مدل ایرپاد3,۲.۴,"۳۳۹,۰۰۰"
49,هندزفری بلوتوثی شیائومی مدل Airdotspro0.5,۱,"۳۸۳,۰۰۰"
50,هندزفری بلوتوثی انکر مدلSoundcore R500,۴.۲,"۸۵۰,۰۰۰"
51,هندزفری بلوتوثی زیلوت مدل AirPods Pro,۳.۴,"۹۹۰,۰۰۰"
52,هندزفری بلوتوثی سامسونگ مدل AB-JPP LEVEL U PRO,۳.۵,"۲۷۲,۰۰۰"
53,هندزفری بلوتوثی مدل EF i18 TWS,۴,"۱۵۹,۰۸۰"
54,هندزفری بلوتوثی لنوو مدل HE05 Turbo Bass,۴,"۲۴۴,۰۰۰"
55,هندزفری بلوتوثی مدل TWS F9-5C V 5.3,۴,"۲۶۷,۹۰۰"
56,هندزفری بلوتوثی وان مور مدل EHS PISTON BUDS,۴.۲,"۸۰۹,۹۵۰"
57,هندزفری بلوتوثی مدل inpods 12,۳.۹,"۱۴۹,۰۰۰"
58,هندزفری بلوتوثی مدل F9 With Speaker,۳,"۶۱۵,۰۰۰"
59,هندزفری بلوتوثی شیائومی مدل Earphone 2 Basic,۳.۹,"۸۳۰,۰۰۰"
60,هندزفری بلوتوثی شیائومی مدل P3new,۱.۸,"۳۹۸,۰۰۰"
61,هندزفری بلوتوثی شیائومی مدل SAE Redmi Buds 3,۳.۵,"۱,۰۰۰,۰۰۰"
62,هندزفری بلوتوثی اسکال کندی مدل Dime True Wireless,۴,"۱,۴۵۰,۴۰۰"
63,هندزفری بلوتوثی لنوو مدل QE03 Turdo Bass,۴.۳,"۲۹۹,۰۰۰"
64,هندزفری بلوتوثی کیو سی وای مدل HAL MELOBUDS T17 APTX GLOBAL,-1,"۵۸۰,۰۰۰"
65,هندزفری بلوتوثی مدل F9 With Speaker,۳,"۶۱۵,۰۰۰"
66,هندزفری بلوتوثی شیائومی مدل Earphone 2 Basic,۳.۹,"۸۳۰,۰۰۰"
67,هندزفری بلوتوثی کیو سی وای مدل SDE EARPHONE T13 GLOBAL POWER PALNT,۴.۴,"۷۲۲,۰۰۰"
68,هندزفری بلوتوثی نوکیا مدل E3103,۴,"۹۹۰,۰۰۰"
69,هندزفری بلوتوثی شیائومی مدل Earbuds BasicAir2s2022,۳,"۸۸۰,۰۰۰"
70,هندزفری بلوتوثی تسکو مدل TH 5353 TWS,۳.۹,"۹۹۵,۰۰۰"
71,هندزفری بلوتوثی شیائومی مدل SAE Redmi Buds 3,۳.۵,"۱,۰۰۰,۰۰۰"
72,هندزفری بلوتوثی مدل AirPods 2,۴.۵,"۵۱۹,۰۰۰"
73,هندزفری بلوتوثی نوکیا مدل E3101,۴.۱,"۸۴۶,۰۰۰"
74,هندزفری بلوتوثی نوکیا مدل Lite Earbuds BH-205,۳.۸,"۹۹۹,۰۰۰"
75,هندزفری بلوتوثی مدل ایرپاد 2,۳.۹,"۴۰۲,۰۰۰"
76,هندزفری بلوتوثی کیو سی وای مدل ham melobuds t19 anc,۵,"۹۱۰,۰۰۰"
77,هندزفری بلوتوثی شیائومی مدل pro2022,۳.۳,"۳۴۰,۰۰۰"
78,هندزفری بلوتوثی مدل M19,۳.۹,"۲۵۵,۹۰۰"
79,هندزفری بلوتوثی لنوو مدل ZRE POP UP XT85 APTX 2022,۳.۸,"۵۹۰,۰۰۰"
80,هندزفری بلوتوثی هاینو تکو مدل BD-21 Pro,۴.۳,"۶۸۰,۰۰۰"
81,هندزفری بلوتوثی هاینو تکو مدل POP-2022 Pro,۴.۴,"۸۵۰,۰۰۰"
82,هندزفری بلوتوثی هاینو تکو مدل BD-21 Pro,۴.۳,"۶۸۰,۰۰۰"
83,هندزفری بلوتوثی هاینو تکو مدل POP-2022 Pro,۴.۴,"۸۵۰,۰۰۰"
84,هندزفری بلوتوثی مدل Mi New2022TWSEJ08LS,۲.۱,"۳۶۸,۰۰۰"
85,هندزفری بلوتوثی مدل AirPods 2,۴.۵,"۵۱۹,۰۰۰"
86,هندزفری بلوتوثی ترانیو مدل Ti-4,۳.۹,"۴۹۹,۰۰۰"
87,هندزفری بلوتوثی کلومن پلاس مدل +K-TW3,۲.۵,"۱,۶۹۹,۰۰۰"
88,هندزفری بلوتوثی لنوو مدل MARY LP1 LIVE POD TYT 2021,۴,"۳۱۰,۰۰۰"
89,هندزفری بلوتوثی میبرو مدل Earbuds 2,۴,"۵۹۹,۰۰۰"
90,هندزفری بلوتوثی نوکیا مدل Lite Earbuds BH-205,۳.۸,"۹۹۹,۰۰۰"
91,هندزفری بلوتوثی کیو سی وای مدل ham melobuds t19 anc,۵,"۹۱۰,۰۰۰"
92,هندزفری بلوتوثی هایلو مدل FTI NEW GT6 BLUETOOTH,۵,"۹۸۹,۰۰۰"
93,هندزفری بلوتوثی شیائومی مدل pro2022,۳.۳,"۳۴۰,۰۰۰"
94,هندزفری بلوتوثی هایلو مدل EMA FRD G3 EDITION 2022,-1,"۱,۹۵۰,۰۰۰"
95,هندزفری بلوتوثی جی بی ال مدل Tune 230 NC,-1,"۳,۷۰۰,۰۰۰"
96,هندزفری بلوتوثی مدل M19,۳.۹,"۲۵۵,۹۰۰"
97,هندزفری بلوتوثی لنوو مدل ZRE POP UP XT85 APTX 2022,۳.۸,"۵۹۰,۰۰۰"
98,هندزفری بلوتوثی تسکو مدل TH 5359 TWS,۳.۴,"۱,۱۳۸,۰۰۰"
99,هندزفری بلوتوثی شیائومی مدل redmi2022pr,۳,"۳۳۲,۰۰۰"
100,هندزفری بلوتوثی شیائومی مدل Mi Bluetooth Neckband Earphones,۳.۷,"۹۴۸,۰۰۰"
101,هندزفری بلوتوثی کیو سی وای مدل QCY T8,۴.۵,"۷۸۵,۰۰۰"
102,هندزفری بلوتوثی لنوو مدل HE05x,۳.۹,"۱۵۹,۰۰۰"
103,هندزفری بلوتوثی شیائومی مدل THI GLOBAL EARBUDS REDMI BUDS 3 PRO REDUCTION,-1,"۴,۶۶۰,۰۰۰"
104,هندزفری بلوتوثی مدل Mi New2022TWSEJ08LS,۲.۱,"۳۶۸,۰۰۰"
105,هندزفری بلوتوثی ترانیو مدل Ti-4,۳.۹,"۴۹۹,۰۰۰"
106,هندزفری بلوتوثی نوکیا مدل Solo Bud SB-101,۴.۲,"۷۶۹,۰۰۰"
107,هندزفری بلوتوثی کلومن مدل KB-T255,۴.۷,"۳۹۸,۰۰۰"
108,هندزفری بلوتوثی کلومن پلاس مدل +K-TW3,۲.۵,"۱,۶۹۹,۰۰۰"
109,هندزفری بلوتوثی لنوو مدل MARY LP1 LIVE POD TYT 2021,۴,"۳۱۰,۰۰۰"
110,هندزفری بلوتوثی میبرو مدل Earbuds 2,۴,"۵۹۹,۰۰۰"
111,هندزفری بلوتوثی مدل BTH-F9-5,۳.۹,"۲۱۹,۰۰۰"
112,هندزفری بلوتوثی تسکو مدل TH 5383,۳.۹,"۶۱۶,۰۰۰"
113,هندزفری بلوتوثی وان مور مدل Omthing EO008,۴.۳,"۷۳۰,۰۰۰"
114,هندزفری بلوتوثی ایکس کین مدل pro 5 tws07,۴.۴,"۹۰۰,۰۰۰"
115,هندزفری بلوتوثی ایکس-انرژی مدل X-03,۴.۴,"۱,۱۶۰,۰۰۰"
116,هندزفری بلوتوثی لنوو مدل QE08 New version,۴.۲,"۲۶۰,۰۰۰"
117,هندزفری بلوتوثی هایلو مدل HAM T15 HEADPHONENEW,-1,"۷۹۵,۰۰۰"
118,هندزفری بلوتوثی کیو سی وای مدل ZRE CONDUCTION T19 SEMI IN EAR,۲.۵,"۷۹۵,۰۰۰"
119,هندزفری بلوتوثی مدل TWS_F9_V5.1,۳.۸,"۲۲۵,۰۰۰"
120,هندزفری بلوتوثی کیو سی وای مدل HAL GLOBAL VERSION T13 HI-FI 2022,۴.۵,"۶۷۲,۰۰۰"
121,هندزفری بلوتوثی مدل گردنی 399,۲.۸,"۴۴۹,۳۲۰"
122,هندزفری بلوتوثی کیو سی وای مدل EMA T5 TRUE 2022 DECODE,-1,"۱,۱۹۰,۰۲۰"
123,هندزفری بلوتوثی شیائومی مدل MOB NECKBAND EARPHON 2022 NEW SPORT BLUETOOTH,-1,"۱,۵۵۵,۰۰۰"
124,هندزفری بلوتوثی تسکو مدل TH 5393,۴.۲,"۲۰۹,۰۰۰"
125,هندزفری بلوتوثی ریلمی مدل R2,۳.۲,"۱۰۰,۰۰۰"
126,هندزفری بلوتوثی لنیز مدل A30,۴.۴,"۴۶۰,۰۰۰"
127,هندزفری بلوتوثی هایلو مدل EMA W1 REDUCTION 2021,۵,"۱,۵۹۰,۱۷۰"
128,هندزفری بلوتوثی نوکیا مدل Solo Bud SB-101,۴.۲,"۷۶۹,۰۰۰"
129,هندزفری بلوتوثی شیائومی مدل Earbyds Basic Air2s,۳.۶,"۸۸۰,۰۰۰"
130,هندزفری بلوتوثی اکسیژن مدل E3,۴.۴,"۵۷۰,۰۰۰"
131,هندزفری بلوتوثی وان مور مدل COMFOBUDS 2 ES3033,۴.۳,"۱,۸۷۰,۰۰۰"
132,هندزفری بلوتوثی وان مور مدل Omthing EO008,۴.۳,"۷۳۰,۰۰۰"
133,هندزفری بلوتوثی کیو سی وای مدل ZRE CONDUCTION T19 SEMI IN EAR,۲.۵,"۷۹۵,۰۰۰"
134,هندزفری بلوتوثی تسکو مدل TH 5390,۳.۳,"۴۶۰,۰۰۰"
135,هندزفری بلوتوثی لیتو مدل LT-3,۳.۸,"۸۰۰,۰۰۰"
136,هندزفری بلوتوثی اسکال کندی مدل Push Active,۴.۴,"۴,۶۰۰,۰۰۰"
137,هندزفری بلوتوثی مدل a120,۴.۲,"۹۵,۶۹۰"
138,هندزفری بلوتوثی تسکو مدل TH 5383,۳.۹,"۶۱۶,۰۰۰"
139,هندزفری بلوتوثی لنوو مدل XT91,۳.۷,"۳۹۹,۰۰۰"
140,هندزفری بلوتوثی رسی مدل G500 PRO,۳,"۲,۵۹۳,۰۰۰"
141,هندزفری بلوتوثی دبلیو یو دبلیو مدل  WUW-S01,-1,"۱,۰۹۰,۰۰۰"
142,هندزفری بلوتوثی رسی مدل G500 PRO,۳,"۲,۵۹۳,۰۰۰"
143,هندزفری بلوتوثی تسکو مدل TH 5397,۴.۲,"۲۴۲,۰۰۰"
144,هندزفری بلوتوثی کیو سی وای مدل ZRE CONDUCTION T19 SEMI IN EAR,۲.۵,"۷۹۵,۰۰۰"
145,هندزفری بلوتوثی دبلیو یو دبلیو مدل  WUW-S01,-1,"۱,۰۹۰,۰۰۰"
146,هندزفری بلوتوثی مدل TWS_F9_V5.1,۳.۸,"۲۲۵,۰۰۰"
147,هندزفری بلوتوثی مدل گردنی 399,۲.۸,"۴۴۹,۳۲۰"
148,هندزفری بلوتوثی شیائومی مدل RedmiAirDotspro2022TWSEJ,۱,"۳۴۰,۰۰۰"
149,هندزفری بلوتوثی مدل a120,۴.۲,"۹۵,۶۹۰"
150,هندزفری بلوتوثی جی بی ال  مدل Tune215 TWS,۳.۹,"۱,۷۲۰,۰۰۰"
151,هندزفری بلوتوثی مدل RedmiAirDots pro 2022 5.0,۳.۳,"۴۷۱,۵۱۰"
152,هندزفری بلوتوثی نوکیا مدل Comfort Earbuds Pro TWS-631W,۳.۵,"۲,۷۹۰,۰۰۰"
153,هندزفری بلوتوثی جی بی ال مدل SAE Lifestyle Tune 205BT in-Ear,۳,"۸۶۰,۰۰۰"
154,هندزفری بلوتوثی شیائومی مدل red pro5.0,۱.۳,"۳۹۸,۵۱۰"
155,هندزفری بلوتوثی ترانیو مدل T-I4 PRO III,۴.۲,"۷۰۰,۰۰۰"
156,هندزفری بلوتوثی مدل ایرپاد نیوز ارداتس پرو3,۳,"۴۰۴,۰۰۰"
157,هندزفری بلوتوثی مدل گردنی,۳.۳,"۱۸۵,۵۰۰"
158,هندزفری بلوتوثی شیائومی مدل MEH AIR DOTS 3 2021,۲.۳,"۶۵۰,۰۰۰"
159,هندزفری بلوتوثی جی بی ال مدل EFN X GLO TOG FLASH,-1,"۷,۸۹۳,۰۰۰"
160,هندزفری بلوتوثی کیو سی وای مدل MIH REDUCTION T18 BLUETOOTH GLOBAL,۱,"۱,۱۶۵,۰۰۰"
161,هندزفری بلوتوثی مدل airpod pro,۴,"۳۳۰,۰۰۰"
162,هندزفری بلوتوثی شیائومی مدل Pr3novel3,۲,"۳۷۹,۰۰۰"
163,هندزفری بلوتوثی مدل Sport,۲,"۵۹,۰۲۰"
164,هندزفری بلوتوثی ام پی بلبری مدل K335,۴.۳,"۱۲۳,۰۰۰"
165,هندزفری بلوتوثی شیائومی مدل MOB NECKBAND EARPHON 2022 NEW SPORT BLUETOOTH,-1,"۱,۵۵۵,۰۰۰"
166,هندزفری بلوتوثی شیائومی مدل گیمینگ2022,۳.۳,"۴۱۲,۰۰۰"
167,هندزفری بلوتوثی لیتو مدل LB-07,۵,"۸۵۰,۰۰۰"
168,هندزفری بلوتوثی لنوو مدل XE05 Pluse,۴.۲,"۲۷۵,۰۰۰"
169,هندزفری بلوتوثی باسئوس مدل Encok-WM01 Plus,۴.۱,"۶۴۸,۰۰۰"
170,هندزفری بلوتوثی لنیز مدل A30,۴.۴,"۴۶۰,۰۰۰"
171,هندزفری بلوتوثی باسئوس مدل ENCOK W3,۴,"۷۱۵,۰۰۰"
172,هندزفری بلوتوثی اسکال کندی مدل Dime 2,-1,"۱,۸۵۰,۰۰۰"
173,هندزفری بلوتوثی لیتو مدل LB-011,۳.۹,"۴۶۰,۰۰۰"
174,هندزفری بلوتوثی اکسیژن مدل E3,۴.۴,"۵۷۰,۰۰۰"
175,هندزفری بلوتوثی مدل ایرپاد 3,۳.۵,"۳۴۵,۰۰۰"
176,هندزفری بلوتوثی وان مور مدل COMFOBUDS 2 ES3033,۴.۳,"۱,۸۷۰,۰۰۰"
177,هندزفری بلوتوثی جی بی ال مدل Tune225 TWS Ghost,۳,"۲,۸۰۰,۰۰۰"
178,هندزفری بلوتوثی مدل sports,۳.۷,"۷۰,۹۷۰"
179,هندزفری بلوتوثی مدل  تک گوش,۳.۶,"۶۷,۰۰۰"
180,هندزفری بلوتوثی مدل a120,۴.۲,"۹۵,۶۹۰"
181,هندزفری بلوتوثی مدل M10 newest_v5.1,۳.۶,"۲۳۵,۰۰۰"
182,هندزفری بلوتوثی اکسین مدل B3,-1,"۴۲۰,۰۰۰"
183,هندزفری بلوتوثی شیائومی مدل redmi pro new5.0,۲.۴,"۳۷۸,۵۱۰"
184,هندزفری بلوتوثی شیائومی مدل Pr3novel3,۲,"۳۷۹,۰۰۰"
185,هندزفری بلوتوثی مدل Sport,۲,"۵۹,۰۲۰"
186,هندزفری بلوتوثی شیائومی مدل MOP EARHOOK EARPHON 2 PRO 2022,-1,"۲,۹۹۰,۰۰۰"
187,هندزفری بلوتوثی ام پی بلبری مدل K335,۴.۳,"۱۲۳,۰۰۰"
188,هندزفری بلوتوثی لنوو مدل Neck Band Earphone-He05 Lite 2022,۳.۷,"۲۷۵,۰۰۰"
189,هندزفری بلوتوثی شیائومی مدل گیمینگ2022,۳.۳,"۴۱۲,۰۰۰"
190,هندزفری بلوتوثی اوی مدل T52 Pro,۳,"۱,۰۸۹,۰۰۰"
191,هندزفری بلوتوثی لنوو مدل live pods LP6,۴,"۸۹۰,۰۰۰"
192,هندزفری بلوتوثی مدل (AirPods Pro (ANC,۳.۲,"۴۹۰,۰۰۰"
193,هندزفری بلوتوثی مدل EF LEVEL U PRO ACTIVE,۲.۶,"۳۱۵,۰۰۰"
194,هندزفری بلوتوثی مدل AIR pad p21,۳.۶,"۱۱۰,۰۰۰"
195,هندزفری بلوتوثی لنوو مدل XE05 Pluse,۴.۲,"۲۷۵,۰۰۰"
196,هندزفری بلوتوثی لیتو مدل LB-07,۵,"۸۵۰,۰۰۰"
197,هندزفری بلوتوثی ریمکس مدل RX-S100,۲.۹,"۳۲۰,۰۰۰"
198,هندزفری بلوتوثی بروفون مدل BC34,۴.۵,"۳۳۸,۰۰۰"
199,هندزفری بلوتوثی لنوو مدل HE08 new version,۳.۸,"۳۷۹,۰۰۰"
200,هندزفری بلوتوثی وان مور مدل MEH PISTON BUDS 2021,۳.۹,"۸۲۴,۰۱۰"
201,هندزفری بلوتوثی مدل ایرپاد 3,۳.۵,"۳۴۵,۰۰۰"
202,هندزفری بلوتوثی شیائومی مدل LYXQEJ02JY,۳.۶,"۱,۰۱۵,۰۰۰"
203,هندزفری بلوتوثی لنوو مدل ZRE HANDSFREE LP3 PRO BEAM FORMING,-1,"۱,۳۰۹,۳۸۰"
204,هندزفری بلوتوثی جی بی ال  مدل Tune215 TWS,۳.۹,"۱,۷۲۰,۰۰۰"
205,هندزفری بلوتوثی وان مور مدل ABR NYT PISTON FIT E1028 FGF2022,۱,"۱,۵۸۸,۸۶۰"
206,هندزفری بلوتوثی سونی مدل WI-C310,۳.۷,"۱,۲۰۰,۰۰۰"
207,هندزفری بلوتوثی مدل S109-V5,۳.۹,"۱۱۳,۰۰۰"
208,هندزفری بلوتوثی مدل ایرپاد نیوز ارداتس پرو3,۳,"۴۰۴,۰۰۰"
209,هندزفری بلوتوثی ترانیو مدل TI3 PRO700,۴.۵,"۷۹۹,۰۰۰"
210,هندزفری بلوتوثی شیائومی مدل MEH AIR DOTS 3 2021,۲.۳,"۶۵۰,۰۰۰"
211,هندزفری بلوتوثی اونیکوما مدل T35,-1,"۸۱۰,۰۰۰"
212,هندزفری بلوتوثی جی بی ال مدل EFN X GLO TOG FLASH,-1,"۷,۸۹۳,۰۰۰"
213,هندزفری بلوتوثی ترانیو مدل T-I2,۳.۴,"۵۱۸,۵۰۰"
214,هندزفری بلوتوثی مدل NEWEST V5.1 M10,۴.۱,"۲۴۸,۰۰۰"
215,هندزفری بلوتوثی ایکس کین مدل pro 3 tws05,۳.۱,"۹۸۸,۰۰۰"
216,هندزفری بلوتوثی مدل airpod pro,۴,"۳۳۰,۰۰۰"
217,هندزفری بلوتوثی ایکس کین مدل XK-TWS05,۴.۲,"۶۹۹,۰۰۰"
218,هندزفری بلوتوثی نوکیا مدل E3102,۴,"۱,۵۴۰,۰۰۰"
219,هندزفری بلوتوثی لنوو مدل LP11,۳.۷,"۳۹۵,۰۰۰"
220,هندزفری بلوتوثی هارمن کاردن مدل Fly BT,-1,"۵,۷۹۰,۰۰۰"
221,هندزفری بلوتوثی شیائومی مدل ADpro,۴,"۳۴۰,۰۰۰"
222,هندزفری بلوتوثی اوی مدل T52 Pro,۳,"۱,۰۸۹,۰۰۰"
223,هندزفری بلوتوثی ام پی بلبری مدل BLB-K333n,۳.۳,"۹۹,۰۰۰"
224,هندزفری بلوتوثی مانوئلی مدل NG Airpods کد 9099294-TU,۳,"۸۱۰,۰۰۰"
225,هندزفری بلوتوثی جی بی ال مدل endurance run bt,۴.۲,"۱,۵۰۰,۰۰۰"
226,هندزفری بلوتوثی نوکیا مدل E3102,۴,"۱,۵۴۰,۰۰۰"
227,هندزفری بلوتوثی هارمن کاردن مدل Fly BT,-1,"۵,۷۹۰,۰۰۰"
228,هندزفری بلوتوثی ریمکس مدل RX-S100,۲.۹,"۳۲۰,۰۰۰"
229,هندزفری بلوتوثی باسئوس مدل SIMU S1,۳.۵,"۱,۲۸۷,۰۰۰"
230,هندزفری بلوتوثی باسئوس مدل ENCOK-W04,۳.۹,"۶۴۵,۷۶۰"
231,هندزفری بلوتوثی گرین مدل TWS,۳.۹,"۱,۱۱۰,۰۰۰"
232,هندزفری بلوتوثی لنوو مدل EMI NECKBAND QE03 BUDS,۵,"۸۳۵,۰۰۰"
233,هندزفری بلوتوثی مدل ایرپاد پرو,۳.۲,"۴۹۹,۰۰۰"
234,هندزفری بلوتوثی مدل airpod pro anc,۴,"۴۵۲,۰۰۰"
235,هندزفری بلوتوثی لیتو مدل lb-11,۴.۲,"۱,۸۰۰,۰۰۰"
236,هندزفری بلوتوثی مدل EZ12,۴,"۵۸۵,۰۰۰"
237,هندزفری بلوتوثی لیتو مدل LT-5,۵,"۱,۲۹۷,۴۰۰"
238,هندزفری بلوتوثی مدل pp,۴.۳,"۱۴۰,۰۰۰"
239,هندزفری بلوتوثی مدل ایرپاد 2 کرک ایرلند,۳.۹,"۴۷۹,۰۰۰"
240,هندزفری بلوتوثی اونیکوما مدل T35,-1,"۸۱۰,۰۰۰"
241,هندزفری بلوتوثی ایکس کین مدل pro 3 tws05,۳.۱,"۹۸۸,۰۰۰"
242,هندزفری بلوتوثی لنوو مدل thinkplus Liveods LP40,۳,"۵۴۸,۰۰۰"
243,هندزفری بلوتوثی لیتو مدل lb-11,۴.۲,"۱,۸۰۰,۰۰۰"
244,هندزفری بلوتوثی سونی مدل WI-C310,۳.۷,"۱,۲۰۰,۰۰۰"
245,هندزفری بلوتوثی مدل S109-V5,۳.۹,"۱۱۳,۰۰۰"
246,هندزفری بلوتوثی هوکو مدل E61,۲.۵,"۳۴۵,۰۰۰"
247,هندزفری بلوتوثی لیتو مدل LT-5,۵,"۱,۲۹۷,۴۰۰"
248,هندزفری بلوتوثی مدل pp,۴.۳,"۱۴۰,۰۰۰"
249,هندزفری بلوتوثی اوی مدل t52,۳.۵,"۸۴۵,۰۰۰"
250,هندزفری بلوتوثی مک دودو مدل HP-801,۴.۲,"۱,۸۵۰,۰۰۰"
251,هندزفری بلوتوثی جوی روم مدل JR-T03S,-1,"۸۹۰,۰۰۰"
252,هندزفری بلوتوثي مدل ايرپاد 2,۳.۵,"۴۴۹,۹۹۰"
253,هندزفری بلوتوثی ترانیو مدل T-I3,-1,"۶۵۰,۰۰۰"
254,هندزفری بلوتوثی سلبریت مدل TWS-W15,-1,"۵۰۴,۰۰۰"
255,هندزفری بلوتوثی اُرایمو مدل 635BT,۳.۵,"۳۴۰,۰۰۰"
256,هندزفری بلوتوثی پرووان مدل PHB3220,۴.۳,"۸۹۴,۰۰۰"
257,هندزفری بلوتوثی باسئوس مدل Bowie EX,۵,"۲,۶۸۹,۰۰۰"
258,هندزفری بلوتوثی مدل airpods pro,۴.۲,"۵۳۰,۶۳۰"
259,هندزفری بلوتوثی اُرایمو مدل OEB-E02D,-1,"۸۹۰,۰۰۰"
260,هندزفری بلوتوثی وان مور مدل EFN REDUCTION ED 9001 TA NEW,-1,"۶,۹۴۱,۰۰۰"
261,هندزفری بلوتوثی مدل 12 iphon,۲.۶,"۲۱۰,۰۰۰"
262,هندزفری بلوتوثی جووی مدل H112,۴.۶,"۱,۳۹۰,۰۰۰"
263,هندزفری بلوتوثی پرووان مدل PHB3220,۴.۳,"۸۹۴,۰۰۰"
264,هندزفری بلوتوثی تسکو مدل TH5391,۳.۸,"۳۹۶,۰۰۰"
265,هندزفری بلوتوثی مدل NEWEST V5.1 M10,۴.۱,"۲۴۸,۰۰۰"
266,هندزفری بلوتوثی لنوو مدل LP2,۳.۸,"۴۹۵,۰۰۰"
267,هندزفری بلوتوثی شیائومی مدل airdots pro2022,-1,"۳۴۰,۰۰۰"
268,هندزفری بلوتوثی مدل airpod pro کد A2084,۳.۵,"۴۹۰,۰۰۰"
269,هندزفری بلوتوثی ایکس کین مدل XK-TWS05,۴.۲,"۶۹۹,۰۰۰"
270,هندزفری بلوتوثی مدل airpods pro,۴.۲,"۵۳۰,۶۳۰"
271,هندزفری بلوتوثی لنوو مدل LP11,۳.۷,"۳۹۵,۰۰۰"
272,هندزفری بلوتوثی مدل Pro1,-1,"۸۲,۵۰۰"
273,هندزفری بلوتوثی شیائومی مدل ADpro,۴,"۳۴۰,۰۰۰"
274,هندزفری بلوتوثی وان مور مدل EFN REDUCTION ED 9001 TA NEW,-1,"۶,۹۴۱,۰۰۰"
275,هندزفری بلوتوثی مدل MS7,۳.۵,"۷۳,۰۴۰"
276,هندزفری بلوتوثی هایلو مدل dye tws moripods adjustable,-1,"۱,۰۷۶,۰۰۰"
277,هندزفری بلوتوثی آکی مدل EP-T25,۳.۵,"۷۹۵,۰۰۰"
278,هندزفری بلوتوثی جوی روم مدل MEH T13 CFR JR,-1,"۸۹۹,۰۰۰"
279,هندزفری بلوتوثی ترانیو مدل MX8,۳.۷,"۳۵۰,۷۵۰"
280,هندزفری بلوتوثی مدل Pro airdots3 2022,۲.۴,"۴۳۰,۰۰۰"
281,هندزفری بلوتوثی ریمکس مدل TWS-10i,۳.۴,"۶۲۷,۰۰۰"
282,هندزفری بلوتوثی شیائومی مدل ZOH REDUCTION BUDS3 LITE ENC,-1,"۱,۲۲۱,۷۲۰"
283,هندزفری بلوتوثی مک دودو مدل HP-801,۴.۲,"۱,۸۵۰,۰۰۰"
284,هندزفری بلوتوثی دبلیو یو دبلیو مدل WW-R146,-1,"۸۷۰,۰۰۰"
285,هندزفری بلوتوثی ترانیو مدل T-I3,-1,"۶۵۰,۰۰۰"
286,هندزفری بلوتوثی مدل airpods pro,۴.۲,"۵۳۰,۶۳۰"
287,هندزفری بلوتوثی مدل ایرپاد 2,۴,"۳۹۹,۰۰۰"
288,هندزفری بلوتوثی وان مور مدل EFN REDUCTION ED 9001 TA NEW,-1,"۶,۹۴۱,۰۰۰"
289,هندزفری بلوتوثی اونیکوما مدل T38,-1,"۹۵۰,۰۰۰"
290,هندزفری بلوتوثی مدل MS7,۳.۵,"۷۳,۰۴۰"
291,هندزفری بلوتوثی وان مور مدل ComfoBuds 2,۳.۷,"۱,۵۳۸,۲۹۰"
292,هندزفری بلوتوثی مدل i100,۳.۱,"۲۱۵,۰۰۰"
293,هندزفری بلوتوثی آکی مدل EP-T25,۳.۵,"۷۹۵,۰۰۰"
294,هندزفری بلوتوثی موبووی مدل TicPods 2 Pro plus,۱.۷,"۸,۳۰۰,۰۰۰"
295,هندزفری بلوتوثی شیائومی مدل NBA ADJUSTABLE EARPHONE 2S GLOBAL 2021,-1,"۲,۰۶۰,۳۵۰"
296,هندزفری بلوتوثی جوی روم مدل MEH T13 CFR JR,-1,"۸۹۹,۰۰۰"
297,هندزفری بلوتوثی مدل TWS BTH-241,۵,"۹۶۰,۰۰۰"
298,هندزفری بلوتوثی کیو سی وای مدل NSH ADJUSTABLE G1 GLOBAL GAMING,-1,"۱,۸۸۲,۳۲۰"
299,هندزفری بلوتوثی هایلو مدل dye tws moripods adjustable,-1,"۱,۰۷۶,۰۰۰"
300,هندزفری بلوتوثی باسئوس مدل MOB E2 TWS Wireless Earphone Bluetooth 5.0,۳,"۹۸۹,۶۰۰"
301,هندزفری بلوتوثی مدل Pro airdots3 2022,۲.۴,"۴۳۰,۰۰۰"
302,هندزفری بلوتوثی آکی مدل EP-T25,۳.۵,"۷۹۵,۰۰۰"
