,name,rate,price
604,هندزفری بلوتوثی مدل A-13,-1,"۸۲۰,۰۰۰"
605,هندزفری بلوتوثی ادیفایر مدل SER GM6 True,-1,"۱,۹۷۵,۰۰۰"
606,هندزفری بلوتوثی سیکنای مدل T1000,-1,"۱,۹۰۰,۰۰۰"
607,هندزفری بلوتوثی مدل Mi Neckband Earphone,۲.۲,"۲۱۹,۰۰۰"
608,هندزفری بلوتوثی بلکین مدل PAC003btPK SoundForm Nano,-1,"۱,۷۸۷,۶۰۰"
609,هندزفری بلوتوثی ریمکس مدل RB-T2,۳.۴,"۳۱۷,۵۲۰"
610,هندزفری بلوتوثی کینگ یو مدل مینی,-1,"۴۵۰,۰۰۰"
611,هندزفری بلوتوثی یوسمز مدل US-JY01,۴,"۸۷۰,۰۰۰"
612,هندزفری بلوتوثی لنوو مدل EHS LP11 MNM,۱,"۴۷۳,۰۰۰"
613,هندزفری بلوتوثی شیائومی مدل SAN Xiaomi Mi True Wireless Earphones 2S TWSEJ07WM,-1,"۲,۰۸۹,۷۱۰"
614,هندزفری بلوتوثی مدل Airdotspro mod,۱,"۳۹۸,۰۰۰"
615,هندزفری بلوتوثی شیائومی مدل redmi3new,-1,"۳۴۰,۰۰۰"
616,هندزفری بلوتوثی نیلکین مدل CandyBox C2,۲.۵,"۹۹۹,۰۰۰"
617,هندزفری بلوتوثی باسئوس مدل SIMU S1 PRO new version,-1,"۱,۷۵۰,۰۰۰"
618,هندزفری بلوتوثی لنوو مدل MHD SPORT XT96 EARBUDS,-1,"۱,۱۴۷,۷۸۰"
619,هندزفری بلوتوثی مدل 2,-1,"۶۶۱,۵۰۰"
620,هندزفری بلوتوثی لنوو مدل H204,۳.۳,"۱۸۵,۴۱۰"
621,هندزفری بلوتوثی باسئوس مدل NGWM01,-1,"۶۴۸,۵۰۰"
622,هندزفری بلوتوثی ریمکس مدل TWS-45,۲,"۶۶۴,۰۰۰"
623,هندزفری بلوتوثی وان پلاس مدل ELM NECKBAND BULLT Z NEW 2022,-1,"۲,۲۲۵,۲۸۰"
624,هندزفری بلوتوثی ترانیو مدل M14,۳,"۲۰۹,۰۰۰"
625,هندزفری بلوتوثی نیلکین مدل CandyBox C2,۲.۵,"۹۹۹,۰۰۰"
626,هندزفری بلوتوثی باسئوس مدل SIMU S1 PRO new version,-1,"۱,۷۵۰,۰۰۰"
627,هندزفری بلوتوثی مودیو مدل ME12,-1,"۶۷۰,۰۰۰"
628,هندزفری بلوتوثی شیائومی مدل 2022,۳.۷,"۳۹۰,۰۰۰"
629,هندزفری بلوتوثی لنوو مدل MHD SPORT XT96 EARBUDS,-1,"۱,۱۴۷,۷۸۰"
630,هندزفری بلوتوثی آرسون مدل AN-727,۴.۸,"۳۷۵,۰۰۰"
631,هندزفری بلوتوثی پرووان مدل PHB3260,۳.۲,"۹۳۹,۰۰۰"
632,هندزفری بلوتوثی شیائومی مدل SAN Xiaomi Mi True Wireless Earphones 2S TWSEJ07WM,-1,"۲,۰۸۹,۷۱۰"
633,هندزفری بلوتوثی مدل Airdotspro mod,۱,"۳۹۸,۰۰۰"
634,هندزفری بلوتوثی مدل 2,-1,"۶۶۱,۵۰۰"
635,هندزفری بلوتوثی مدل A-13,-1,"۸۲۰,۰۰۰"
636,هندزفری بلوتوثی ریمکس مدل RB-T2,۳.۴,"۳۱۷,۵۲۰"
637,هندزفری بلوتوثی کینگ یو مدل مینی,-1,"۴۵۰,۰۰۰"
638,هندزفری بلوتوثی وان مور مدل MDI EARBUDS ED9001 SERIESS,-1,"۵,۱۴۸,۸۲۰"
639,هندزفری بلوتوثی لنوو مدل SHO LP3 PRO 2022,۴,"۱,۲۴۳,۴۵۰"
640,هندزفری بلوتوثی مدل Airdots pro3,۲.۸,"۳۲۲,۰۰۰"
641,هندزفری بلوتوثی جی بی ال مدل EMD LIVE NC FREE TWS ANC,-1,"۵,۳۲۸,۴۳۰"
642,هندزفری بلوتوثی لنوو مدل EMD HAEDPHONE LP6 TURE,-1,"۱,۴۰۰,۰۰۰"
643,هندزفری بلوتوثی ریمکس مدل TWS-15,۳,"۸۸۰,۰۰۰"
644,هندزفری بلوتوثی باسئوس مدل SEP Encok W05 True Wireless Earphones,-1,"۲,۴۱۷,۲۴۰"
645,هندزفری بلوتوثی آبودوس مدل TW-12,-1,"۸۲۵,۰۰۰"
646,هندزفری بلوتوثی لنوو مدل HAL BUDS TC08 PRO ADJUSTABLE,-1,"۱,۸۳۳,۵۲۰"
647,هندزفری بلوتوثی لنوو مدل MED BLUETOOTH H15 PRO BT 2022,-1,"۱,۸۲۹,۳۱۰"
648,هندزفری بلوتوثی مدل Airdotspro3,۱.۳,"۴۰۴,۲۰۰"
649,هندزفری بلوتوثی  مدل Air pods pro,۳,"۳۶۰,۶۴۰"
650,هندزفری بلوتوثی موکسوم مدل MX-TW14,-1,"۵۴۴,۳۲۰"
651,هندزفری بلوتوثی مدل Airpods Pro,۳,"۴۳۰,۰۰۰"
652,هندزفری بلوتوثی یوسمز مدل NX10,-1,"۸۲۵,۰۰۰"
653,هندزفری بلوتوثی اس جی اس مدل بادیگارد,۴,"۲۵۰,۰۰۰"
654,هندزفری بلوتوثی آوی مدل A810BL,۲.۹,"۳۷۵,۰۰۰"
655,هندزفری بلوتوثی مدل AirPods Pro High,۳.۴,"۴۰۵,۰۰۰"
656,هندزفری بلوتوثی وایسون مدل E19,۴,"۳۳۵,۰۰۰"
657,هندزفری بلوتوثی جی وی سی مدل HA-FX33XBT,۴.۳,"۳۱۳,۰۸۰"
658,هندزفری بلوتوثی مدل BASIC 2,-1,"۴۵۰,۰۰۰"
659,هندزفری بلوتوثی مدل LLQYE9S,۳.۸,"۱۳۰,۰۰۰"
660,هندزفری بلوتوثی هویت مدل IX300,۲.۳,"۵۲۸,۰۰۰"
661,هندزفری بلوتوثی شیائومی مدل SHO STEREO 2BASIC NEW 2022,-1,"۱,۴۶۰,۰۳۰"
662,هندزفری بلوتوثی لنوو مدل H201,۳.۸,"۲۵۵,۰۰۰"
663,هندزفری بلوتوثی لنوو مدل  Hifi SSB,-1,"۷۹۲,۰۰۰"
664,هندزفری بلوتوثی مدل U50 TWS,-1,"۶۵۰,۰۰۰"
665,هندزفری بلوتوثی ریمکس مدل TWS7,-1,"۹۵۰,۰۰۰"
666,هندزفری بلوتوثی موکسوم مدل MX-TW14,-1,"۵۴۴,۳۲۰"
667,هندزفری بلوتوثی وان پلاس مدل EHA Z SERIES NECKBAND,-1,"۲,۴۷۸,۴۸۰"
668,هندزفری بلوتوثی اس جی اس مدل بادیگارد,۴,"۲۵۰,۰۰۰"
669,هندزفری بلوتوثی یوسمز مدل NX10,-1,"۸۲۵,۰۰۰"
670,هندزفری بلوتوثی مدل m18,۵,"۶۱۰,۰۰۰"
671,هندزفری بلوتوثی مدل Airpods pro,۵,"۴۶۹,۰۰۰"
672,هندزفری بلوتوثی وایسون مدل TWS-T7,-1,"۲,۳۰۰,۰۰۰"
673,هندزفری بلوتوثی مدل AIR DOTS S REDMI 2019,-1,"۳۱۵,۰۰۰"
674,هندزفری بلوتوثی مدل BASIC 2,-1,"۴۵۰,۰۰۰"
675,هندزفری بلوتوثی مدل Mi2022,۳.۱,"۳۷۹,۰۰۰"
676,هندزفری بلوتوثی شیائومی مدل SHO STEREO 2BASIC NEW 2022,-1,"۱,۴۶۰,۰۳۰"
677,هندزفری بلوتوثی مارلی مدل Uprise,-1,"۲,۵۰۰,۰۰۰"
678,هندزفری بلوتوثی پرووان مدل PHB3240,۴.۲,"۱,۰۳۴,۰۰۰"
679,هندزفری بلوتوثی مدل LIVE PRO PLUS کد 01,-1,"۲,۰۳۱,۵۰۰"
680,هندزفری بلوتوثی ژوژی مدل AIR Pad x,۴,"۲۱۰,۰۰۰"
681,هندزفری بلوتوثی لنوو مدل TWS Wireless XT81 Headphons Earphone grade WPSP,-1,"۶۱۸,۱۲۰"
682,هندزفری بلوتوثی جوی روم مدل JR-TL11,۴,"۶۸۵,۰۰۰"
683,هندزفری بلوتوثی یوسمز مدل US-JY01,۴,"۸۷۰,۰۰۰"
684,هندزفری بلوتوثی یسیدو مدل YSP02,-1,"۹۷۷,۰۰۰"
685,هندزفری بلوتوثی باوین مدل 18,۳,"۱,۶۸۰,۰۰۰"
686,هندزفری بلوتوثی لنوو مدل EHS LP11 MNM,۱,"۴۷۳,۰۰۰"
687,هندزفری بلوتوثی نواکس مدل BL-6Pro,-1,"۵۴۵,۰۰۰"
688,هندزفری بلوتوثی مدل Mini Tws 5.0 کد XG-12,۱,"۴۸۷,۵۰۰"
689,هندزفری بلوتوثی مدل Level u pro,۲,"۳۳۵,۰۰۰"
690,هندزفری بلوتوثی اوی مدل JP-AB T29,۳,"۱,۴۰۰,۰۰۰"
691,هندزفری بلوتوثی باسئوس مدل SIMU S1 PRO new version,-1,"۱,۷۵۰,۰۰۰"
692,هندزفری بلوتوثی پرودا مدل PD-BT900,۴.۲,"۵۶۵,۰۰۰"
693,هندزفری بلوتوثی مدل RedMi Air Dots,۲.۹,"۲۳۲,۰۰۰"
694,هندزفری بلوتوثی مدل 2,-1,"۶۶۱,۵۰۰"
695,هندزفری بلوتوثی لنوو مدل  LP6,-1,"۱,۶۰۰,۰۰۰"
696,هندزفری بلوتوثی لنوو مدل TNA TC EAR 02 PRO HANDSFREE,-1,"۱,۵۲۲,۴۳۰"
697,هندزفری بلوتوثی کِووی مدل TW32 PRO,۴,"۲۴۰,۰۰۰"
698,هندزفری بلوتوثی بروفون مدل BC30,۲.۵,"۲۶۷,۶۰۰"
699,هندزفری بلوتوثی ریمکس مدل TWS-15,۳,"۸۸۰,۰۰۰"
700,هندزفری بلوتوثی آبودوس مدل TW-12,-1,"۸۲۵,۰۰۰"
701,هندزفری بلوتوثی باسئوس مدل SEP Encok W05 True Wireless Earphones,-1,"۲,۴۱۷,۲۴۰"
702,هندزفری بلوتوثی مدل LLQYE9S,۳.۸,"۱۳۰,۰۰۰"
703,هندزفری بلوتوثی هویت مدل IX300,۲.۳,"۵۲۸,۰۰۰"
704,هندزفری بلوتوثی جی بی ال مدل HAL SPORY WAVE 200 GLOBAL EARHOOK,-1,"۲,۴۸۱,۲۴۰"
705,هندزفری بلوتوثی موبووی مدل TicPods 2 pro,-1,"۵,۹۰۰,۰۰۰"
706,هندزفری بلوتوثی جی بی ال مدل ELH Promo 100 True,-1,"۲,۴۸۸,۴۴۰"
707,هندزفری بلوتوثی او 2 پلاس مدل OT80,-1,"۷۴۳,۰۲۰"
708,هندزفری مخصوص بازی بلوتوثی موکسوم مدل MX-TW13,۵,"۵۲۵,۱۰۰"
709,هندزفری بلوتوثی ریمکس مدل TWS7,-1,"۹۵۰,۰۰۰"
710,هندزفری بلوتوثی مدل Mi2022new,۲.۸,"۳۵۹,۰۰۰"
711,هندزفری بلوتوثی وان پلاس مدل EHA Z SERIES NECKBAND,-1,"۲,۴۷۸,۴۸۰"
712,هندزفری بلوتوثی مویان مدل MY-17A,۳.۶,"۲۴۰,۰۰۰"
713,هندزفری بلوتوثی بیبوشی مدل R04,-1,"۲۵۰,۰۰۰"
714,هندزفری بلوتوثی مدل QT82,۳.۸,"۳۸۹,۰۰۰"
715,هندزفری بلوتوثی کیو سی وای مدل HAJ 01HT POI,-1,"۲,۱۲۶,۰۰۰"
716,هندزفری بلوتوثی بروفون مدل BE45,۵,"۵۹۰,۰۰۰"
717,هندزفری بلوتوثی لنوو مدل EFM LP1 S NEW,۳.۴,"۱,۴۸۹,۸۶۰"
718,هندزفری بلوتوثی مدل m18,۵,"۶۱۰,۰۰۰"
719,هندزفری بلوتوثی موکسوم مدل MX-TW07,-1,"۵۹۰,۴۶۰"
720,هندزفری بلوتوثی لنوو مدل H201,۳.۸,"۲۵۵,۰۰۰"
721,هندزفری بلوتوثی وایسون مدل TWS-T7,-1,"۲,۳۰۰,۰۰۰"
722,هندزفری بلوتوثی لنوو مدل H-201 2021,۴.۱,"۳۸۰,۰۰۰"
723,هندزفری بلوتوثی مدل wave smart,-1,"۶۰۹,۰۰۰"
724,هندزفری بلوتوثی اوی مدل T12,-1,"۸۸۰,۰۰۰"
725,هندزفری بلوتوثی مدل Colorful Pods,۱,"۲۵۰,۰۰۰"
726,هندزفری بلوتوثی ایکس او مدل XO-BS26,۴,"۴۹۵,۰۰۰"
727,هندزفری بلوتوثی تکنو کد P98,-1,"۱۹۸,۰۰۰"
728,هندزفری بلوتوثی مدل JBL DUET Mini,-1,"۱۹۰,۰۰۰"
729,هندزفری بلوتوثی باسئوس مدل ZRF W04 PRO DSP,۳,"۱,۷۷۶,۴۴۰"
730,هندزفری بلوتوثی پرودو مدل ANC Earbuds,۳,"۱,۰۹۹,۰۰۰"
731,هندزفری بلوتوثی مدل bmm01,۳.۵,"۱۴۰,۰۰۰"
732,هندزفری بلوتوثی هیسکا مدل FX-391,-1,"۵۲۷,۰۰۰"
733,هندزفری بلوتوثی جی بی ال مدل ELH NECKBAND 205 BT WIERLESS,-1,"۱,۴۸۶,۹۴۰"
734,هندزفری بلوتوثی یوسمز مدل LY06,۴,"۷۵۶,۰۰۰"
735,هندزفری بلوتوثی ترانیو مدل M13,۲.۹,"۲۸۲,۷۳۰"
736,هندزفری بلوتوثی انستی مدل AST-B03,۳.۶,"۸۵۰,۰۰۰"
737,هندزفری بلوتوثی باسئوس مدل ZRF 2022 STORM 3 TWS,-1,"۳,۶۵۰,۰۰۰"
738,هندزفری بلوتوثی مدل C330 TWS,۵,"۵۳۰,۰۰۰"
739,هندزفری بلوتوثی او ام تینگ مدل 2021 MARY 2 EO,۵,"۱,۴۴۶,۲۵۰"
740,هندزفری بلوتوثی لنوو مدل MAH ANC LP80 BLUETOOS,-1,"۱,۰۷۳,۰۰۰"
741,هندزفری بلوتوثی جوی روم مدل JR-D6,-1,"۶۴۹,۰۰۰"
742,هندزفری بلوتوثی مدل JBL DUET Mini,-1,"۱۹۰,۰۰۰"
743,هندزفری بلوتوثی باسئوس مدل ZRF W04 PRO DSP,۳,"۱,۷۷۶,۴۴۰"
744,هندزفری بلوتوثی لنوو مدل MMD H203,۲.۵,"۴۹۰,۰۰۰"
745,هندزفری بلوتوثی مدل MIcbnd,۳.۲,"۱۷۵,۸۳۰"
746,هندزفری بلوتوثی موبووی مدل TicPods 2 pro,-1,"۵,۹۰۰,۰۰۰"
747,هندزفری بلوتوثی انستی مدل AST-B03,۳.۶,"۸۵۰,۰۰۰"
748,هندزفری بلوتوثی جی بی ال مدل ELH Promo 100 True,-1,"۲,۴۸۸,۴۴۰"
749,هندزفری بلوتوثی او ام تینگ مدل 2021 MARY 2 EO,۵,"۱,۴۴۶,۲۵۰"
750,هندزفری بلوتوثی تکنو کد P98,-1,"۱۹۸,۰۰۰"
751,هندزفری بلوتوثی جوی روم مدل JR-D6,-1,"۶۴۹,۰۰۰"
752,هندزفری بلوتوثی مدل C330 TWS,۵,"۵۳۰,۰۰۰"
753,هندزفری بلوتوثی لنوو مدل MAH ANC LP80 BLUETOOS,-1,"۱,۰۷۳,۰۰۰"
754,هندزفری بلوتوثی مویان مدل MY-17A,۳.۶,"۲۴۰,۰۰۰"
755,هندزفری بلوتوثی بیبوشی مدل R04,-1,"۲۵۰,۰۰۰"
756,هندزفری بلوتوثی کیو سی وای مدل HAJ 01HT POI,-1,"۲,۱۲۶,۰۰۰"
757,هندزفری بلوتوثی بروفون مدل BE45,۵,"۵۹۰,۰۰۰"
758,هندزفری بلوتوثی موکسوم مدل MX-TW07,-1,"۵۹۰,۴۶۰"
759,هندزفری بلوتوثی جی بی ال مدل EFN INDURANCE DIVE REDUCTION,-1,"۴,۸۳۹,۰۰۰"
760,هندزفری بلوتوثی لنوو مدل X18,۳.۴,"۷۳۸,۰۰۰"
761,هندزفری بلوتوثی مدل Pro 6,۵,"۳۳۳,۰۰۰"
762,هندزفری بلوتوثی جی بی ال مدل MOH 125 TUNE NEW FAC,-1,"۱,۵۲۱,۵۲۰"
763,هندزفری بلوتوثی مدل Wireless athlete series sport,۲.۳,"۱۷۵,۰۰۰"
764,هندزفری بلوتوثی لنوو مدل ZRE TRUE WIRELESS XG02 AMBIENT MODE,-1,"۱,۶۸۸,۳۳۰"
765,هندزفری بلوتوثی باسئوس مدل ELH SIMU ANC S2,۴,"۲,۱۴۰,۰۰۰"
766,هندزفری بلوتوثی لنوو مدل MMD H203,۲.۵,"۴۹۰,۰۰۰"
767,هندزفری بلوتوثی موبووی مدل TicPods 2 pro,-1,"۵,۹۰۰,۰۰۰"
768,هندزفری بلوتوثی دنمن مدل DL19,-1,"۲۹۹,۹۹۰"
769,هندزفری بلوتوثی جی بی ال مدل ELH Promo 100 True,-1,"۲,۴۸۸,۴۴۰"
770,هندزفری بلوتوثی شیائومی مدل EHM NECKBAND BASIC ENC 2022,-1,"۱,۴۵۸,۷۱۰"
771,هندزفری بلوتوثی یس پلاس مدل SEP 2022 BT TWS-01 NERL,-1,"۹۹۹,۰۰۰"
772,هندزفری بلوتوثی مدل SM-R175 Buds Plus,۲.۵,"۵۰۰,۰۰۰"
773,هندزفری بلوتوثی مویان مدل MY-17A,۳.۶,"۲۴۰,۰۰۰"
774,هندزفری بلوتوثی کیو سی وای مدل RAM EARHOOK HT01 GLOBAL LOW LATENCY,-1,"۱,۶۲۰,۰۰۰"
775,هندزفری بلوتوثی مدل airpod3,-1,"۳۵۰,۰۰۰"
776,هندزفری بلوتوثی بیبوشی مدل R04,-1,"۲۵۰,۰۰۰"
777,هندزفری بلوتوثی یوسمز مدل US-BT001,۳.۷,"۲۰۷,۰۰۰"
778,هندزفری بلوتوثی بروفون مدل BE45,۵,"۵۹۰,۰۰۰"
779,هندزفری بلوتوثی کیو سی وای مدل HAJ 01HT POI,-1,"۲,۱۲۶,۰۰۰"
780,هندزفری بلوتوثی لنوو مدل AK TG01 NW,۴,"۲,۳۷۵,۰۰۰"
781,هندزفری بلوتوثی جوی روم مدل B01,-1,"۵۶۵,۰۰۰"
782,هندزفری بلوتوثی مدل Wireless athlete series sport,۲.۳,"۱۷۵,۰۰۰"
783,هندزفری بلوتوثی لنوو مدل ZRE TRUE WIRELESS XG02 AMBIENT MODE,-1,"۱,۶۸۸,۳۳۰"
784,هندزفری بلوتوثی موکسوم مدل MX-WL29,-1,"۵۶۷,۰۴۰"
785,هندزفری بلوتوثی باسئوس مدل ELH SIMU ANC S2,۴,"۲,۱۴۰,۰۰۰"
786,هندزفری بلوتوثی ارلدام مدل BH70,-1,"۳۴۵,۰۰۰"
787,هندزفری بلوتوثی لنوو مدل HEO5-X,-1,"۲۸۱,۰۰۰"
788,هندزفری بلوتوثی رسی مدل REP-W15,-1,"۲۹۹,۰۰۰"
789,هندزفری بلوتوثی آی واک مدل BTCOO1-013A,-1,"۱,۸۶۰,۰۰۰"
790,هندزفری بلوتوثی لنوو مدل EFN REDUCTION XT83 TWS,-1,"۱,۳۲۸,۰۰۰"
791,هندزفری بلوتوثی دنمن مدل DL19,-1,"۲۹۹,۹۹۰"
792,هدفون بلوتوثی هایلو مدل MPO HANDSFREE GT6 EDITION,۴,"۷۰۰,۰۰۰"
793,هندزفری بلوتوثی شیائومی مدل EHM NECKBAND BASIC ENC 2022,-1,"۱,۴۵۸,۷۱۰"
794,هندزفری بلوتوثی مدل SM-R175 Buds Plus,۲.۵,"۵۰۰,۰۰۰"
795,هندزفری بلوتوثی لنوو مدل HAJ LP12 GHJ,-1,"۸۱۶,۰۰۰"
796,هندزفری بلوتوثی مدل airpod3,-1,"۳۵۰,۰۰۰"
797,هندزفری بلوتوثی کیو سی وای مدل RAM EARHOOK HT01 GLOBAL LOW LATENCY,-1,"۱,۶۲۰,۰۰۰"
798,هندزفری بلوتوثی مدل 2022,۳.۸,"۳۹۰,۰۰۰"
799,هندزفری بلوتوثی یوسمز مدل US-BT001,۳.۷,"۲۰۷,۰۰۰"
800,هندزفری بلوتوثی لنوو مدل AK TG01 NW,۴,"۲,۳۷۵,۰۰۰"
801,هندزفری بلوتوثی جوی روم مدل B01,-1,"۵۶۵,۰۰۰"
802,هندزفری بلوتوثی آی واک مدل BTCOO1-013A,-1,"۱,۸۶۰,۰۰۰"
803,هندزفری بلوتوثی لنوو مدل EFN REDUCTION XT83 TWS,-1,"۱,۳۲۸,۰۰۰"
804,هندزفری بلوتوثی جووی مدل ELH H130 True Wireless,-1,"۲,۱۰۰,۰۰۰"
805,هندزفری بلوتوثی پرودو مدل SoundTec Kids Wireless Earbuds,-1,"۷۹۰,۰۰۰"
806,هندزفری بلوتوثی جووی مدل MMD H106 RT 21,-1,"۱,۱۶۱,۲۹۰"
807,هندزفری بلوتوثی مدل MMD BUDS3 CVC,-1,"۱,۰۵۱,۰۲۰"
808,هندزفری بلوتوثی باسئوس مدل S1 new pack 2022,-1,"۱,۳۵۰,۰۰۰"
809,هندزفری بلوتوثی لنوو مدل HAJ LP12 GHJ,-1,"۸۱۶,۰۰۰"
810,هندزفری بلوتوثی لنوو مدل HSA WIRLEES LP60 THINKPLUSE NEW 2022,-1,"۱,۶۹۲,۸۰۰"
811,هندزفری بلوتوثی بلکین مدل AUC005btPK SoundForm Play,-1,"۱,۷۸۷,۶۰۰"
812,هندزفری بلوتوثی لیتوو مدل LB13,-1,"۳۸۵,۰۰۰"
813,هندزفری بلوتوثی موکسوم مدل MX-WL49,-1,"۳۶۶,۱۶۰"
814,هندزفری بلوتوثی مدل Y30 کد Y2COL,۱,"۵۳۰,۰۰۰"
815,هندزفری بلوتوثی مدل pro 18 wireless,-1,"۳۶۰,۰۰۰"
816,هندزفری بلوتوثی اککیو مدل AKY19,-1,"۴۹۹,۹۹۰"
817,هندزفری بلوتوثی سلبریت مدل A8,۲.۳,"۲۵۰,۰۰۰"
818,هندزفری بلوتوثی مومکس مدل BT1,۵,"۱,۱۵۰,۰۰۰"
819,هندزفری بلوتوثی لنوو مدل MOB CONDUCTION LP70 BUDS ENC,-1,"۲,۴۱۴,۸۶۰"
820,هندزفری بلوتوثی لنوو مدل ZRE TRUE WIRELESS XG02 AMBIENT MODE,-1,"۱,۶۸۸,۳۳۰"
821,هندزفری بلوتوثی باسئوس مدل RZA GLOBAL HEADSET SIMU S2 NEW LOW LATENCY,-1,"۳,۵۲۰,۰۰۰"
822,هندزفری بلوتوثی باسئوس مدل KBR HEADSET BOWE E9 GLOBAL HANGING,-1,"۳,۶۱۹,۹۸۰"
823,هندزفری بلوتوثی باسئوس مدل HSE BUDS BOWIE E9 HEADPHONE 2022,-1,"۲,۱۲۰,۰۰۰"
824,هندزفری بلوتوثی مدل pro 18 wireless,-1,"۳۶۰,۰۰۰"
825,هندزفری بلوتوثی اککیو مدل AKY19,-1,"۴۹۹,۹۹۰"
826,هندزفری بلوتوثی لنوو مدل EMA LKB LP12 THINKPLUS,-1,"۹۹۰,۰۰۰"
827,هندزفری بلوتوثی بیکارو مدل Aro Pods 2,-1,"۹۴۰,۰۰۰"
828,هدفون مخصوص بازی بلوتوثی شیائومی مدل ASR HANDSFREE EARPHONE 2 PRO 2022,۲.۵,"۳,۱۶۰,۰۰۰"
829,هندزفری بلوتوثی باسئوس مدل ERF VERSION BOWIE E8 GLOBAL,-1,"۲,۹۸۷,۰۰۰"
830,هندزفری بلوتوثی مدل ایرپاد پرو,۳.۶,"۳۸۵,۰۰۰"
831,هندزفری بلوتوثی باسئوس مدل RZA GLOBAL HEADSET SIMU S2 NEW LOW LATENCY,-1,"۳,۵۲۰,۰۰۰"
832,هندزفری بلوتوثی باسئوس مدل NGS1-02,۲,"۱,۱۵۰,۰۰۰"
833,هندزفری بلوتوثی مدل آپتیموس پرایم,۱,"۸۶۰,۰۰۰"
834,هندزفری بلوتوثی فیل مدل CC pro,۴.۵,"۲,۵۹۰,۰۰۰"
835,هندزفری بلوتوثی موکسوم مدل MX-WL29,-1,"۵۶۷,۰۴۰"
836,هندزفری بلوتوثی کینگ یو مدل H832,۴.۱,"۷۴۹,۰۰۰"
837,هندزفری بلوتوثی لنوو مدل RZA HEADSET HT38 GLOBAL APTX,-1,"۱,۲۶۴,۳۹۰"
838,هندزفری بلوتوثی مدل Earbuds Basic,-1,"۳۱۰,۰۰۰"
839,هندزفری بلوتوثی باسئوس مدل MOH ADJUSTABLE BOWIE E3 EARBUDS,-1,"۱,۹۰۱,۰۴۰"
840,هندزفری بلوتوثی ارلدام مدل BH70,-1,"۳۴۵,۰۰۰"
841,هندزفری بلوتوثی بی وای زد مدل B66,-1,"۶۴۰,۰۰۰"
842,هندزفری بلوتوثی نواکس مدل BL-208,-1,"۲۴۹,۰۰۰"
843,هندزفری بلوتوثی اُرایمو مدل MK-86,۱,"۵۵۰,۰۰۰"
844,هندزفری بلوتوثی موکسوم مدل MX-WL38,-1,"۶۰۸,۰۰۰"
845,هندزفری بلوتوثی وان مور مدل SHO VGY BUDS2 COMFO,-1,"۲,۶۹۹,۹۹۰"
846,هندزفری بلوتوثی موکسوم مدل MX-WL04,۲,"۴۲۰,۰۰۰"
847,هندزفری بلوتوثی للیسو مدل LS-17A,۳.۶,"۹۵۶,۰۰۰"
848,هندزفری بلوتوثی لنوو مدل MEH SINGLE SIDE HX106 HANDS FREE,-1,"۱,۵۸۶,۰۰۰"
849,هندزفری بلوتوثی ترانیو مدل Propod 2,۱.۲,"۷۹۹,۰۰۰"
850,هندزفری بلوتوثی هاینو تکو مدل HN-99,-1,"۴۳۵,۰۰۰"
851,هندزفری بلوتوثی مدل mj-6789,-1,"۲۲۵,۰۰۰"
852,هندزفری بلوتوثی مدل Level 2,۲,"۳۲۵,۹۹۰"
853,هندزفری بلوتوثی باسئوس مدل S06-NGS06,-1,"۶۹۵,۲۰۰"
854,هندزفری بلوتوثی مدل MMD BUDS3 CVC,-1,"۱,۰۵۱,۰۲۰"
855,هندزفری بلوتوثی لنوو مدل HSA WIRLEES LP60 THINKPLUSE NEW 2022,-1,"۱,۶۹۲,۸۰۰"
856,هندزفری بلوتوثی مدل 2022New,۲.۹,"۳۳۲,۰۰۰"
857,هندزفری بلوتوثی لیتوو مدل LB13,-1,"۳۸۵,۰۰۰"
858,هندزفری بلوتوثی لنوو مدل AK 81QT 05,-1,"۱,۴۹۸,۰۰۰"
859,هندزفری بلوتوثی باسئوس مدل MOH ADJUSTABLE BOWIE E3 EARBUDS,-1,"۱,۹۰۱,۰۴۰"
860,هندزفری بلوتوثی سلبریت مدل EFM 11T SWT,-1,"۷۸۹,۰۰۰"
861,هندزفری بلوتوثی مدل m10 V5,۲.۹,"۳۲۰,۰۰۰"
862,هندزفری بلوتوثی باسئوس مدل MOH ADJUSTABLE BOWIE E3 EARBUDS,-1,"۱,۹۰۱,۰۴۰"
863,هندزفری بلوتوثی سلبریت مدل EFM 11T SWT,-1,"۷۸۹,۰۰۰"
864,هندزفری بلوتوثی لنوو مدل AK 81QT 05,-1,"۱,۴۹۸,۰۰۰"
865,هندزفری بلوتوثی مدل Redmi newest wirlles Air2s,-1,"۹۰۰,۰۰۰"
866,هندزفری بلوتوثی مدل redmidots p r o 3,-1,"۴۵۲,۰۰۰"
867,هندزفری بلوتوثی وریتی مدل V-NE78BT,-1,"۳۵۰,۰۰۰"
868,هندزفری بلوتوثی ارلدام مدل EHS 49 BH 21,-1,"۱,۴۰۰,۰۰۰"
869,هندزفری بلوتوثی لنوو مدل MOB CONDUCTION LP70 BUDS ENC,-1,"۲,۴۱۴,۸۶۰"
870,هندزفری بلوتوثی موکسوم مدل MX-WL50,-1,"۳۳۸,۴۰۰"
871,هندزفری بلوتوثی مویان مدل MB-1,-1,"۳۵۰,۰۰۰"
872,هندزفری بلوتوثی بروفون مدل BW09,-1,"۱,۲۵۰,۰۰۰"
873,هندزفری بلوتوثی مدل ایرپادpro3 New,۱,"۳۷۰,۰۰۰"
874,هندزفری بلوتوثی مدل ارداتس پرو3نیوز,۲.۷,"۳۹۰,۰۰۰"
875,هندزفری بلوتوثی مدل SPORT WIRELESS V5.0,-1,"۳۷۷,۰۰۰"
876,هدفون بلوتوثی کیو سی وای مدل LHA HANDSFREE T16 BLUETOOTH 2022,-1,"۱,۶۳۰,۵۶۰"
877,هندزفری بلوتوثی آراوسی مدل cr7,-1,"۱,۲۶۰,۰۰۰"
878,هندزفری بلوتوثی لنوو مدل NAS EARBUDS XT83 TRUE WIRLESS,-1,"۱,۴۴۶,۲۵۰"
879,هندزفری بلوتوثی باسئوس مدل MAH ARI NORA,-1,"۲,۶۵۲,۲۰۰"
880,هندزفری بلوتوثی مدل NECKBAND M-250,۳.۱,"۲۴۵,۰۰۰"
881,هندزفری بلوتوثی اناسفایر مدل E18 کد 9870,-1,"۸۵۰,۰۰۰"
882,هندزفری بلوتوثی مدل Level 2,۲,"۳۲۵,۹۹۰"
883,هندزفری بلوتوثی باسئوس مدل S06-NGS06,-1,"۶۹۵,۲۰۰"
884,هندزفری بلوتوثی لنوو مدل SSU EARBUDS TC08 PRO 2022,-1,"۱,۹۹۶,۶۵۰"
885,هندزفری بلوتوثی کونیکوی مدل K2S,۳.۹,"۳۵۰,۰۰۰"
886,هندزفری بلوتوثی لنوو مدل RZA EARHOOK XT83 GLOBAL APTX,-1,"۱,۳۶۸,۲۳۰"
887,هندزفری بلوتوثی سلبریت مدل SKY5,-1,"۵۹۹,۰۰۰"
888,هندزفری بلوتوثی جی بی ال مدل dye tws125 bt bluotoos,-1,"۱,۴۹۹,۹۹۰"
889,هندزفری بلوتوثی مدل Air Buds Pro,۳.۲,"۶۵۰,۰۰۰"
890,هندزفری بلوتوثی لنوو مدل MARY LP11 GD 2021,۳,"۹۰۰,۰۰۰"
891,هندزفری بلوتوثی مدل m10 V5,۲.۹,"۳۲۰,۰۰۰"
892,هندزفری بلوتوثی مدل Redmi newest wirlles Air2s,-1,"۹۰۰,۰۰۰"
893,هندزفری بلوتوثی مدل redmidots p r o 3,-1,"۴۵۲,۰۰۰"
894,هندزفری بلوتوثی وریتی مدل V-NE78BT,-1,"۳۵۰,۰۰۰"
895,هندزفری بلوتوثی دبلیو کی مدل P3,-1,"۲۲۰,۰۰۰"
896,هندزفری بلوتوثی لنوو مدل PID EARBUDS LP6 EDITION,-1,"۱,۴۵۰,۰۰۰"
897,هندزفری بلوتوثی جووی مدل JP-AB 1H6 UT NEW,-1,"۲,۳۰۰,۰۰۰"
898,هندزفری بلوتوثی مویان مدل MB-1,-1,"۳۵۰,۰۰۰"
899,هندزفری بلوتوثی باسئوس مدل EFN APTX WM01 PLUS TRUO,-1,"۹۸۰,۰۰۰"
900,هندزفری بلوتوثی مدل ایرپادpro3 New,۱,"۳۷۰,۰۰۰"
901,هندزفری بلوتوثی مدل ارداتس پرو3نیوز,۲.۷,"۳۹۰,۰۰۰"
902,هندزفری بلوتوثی هاینو تکو مدل HN-99,-1,"۴۳۵,۰۰۰"
903,هندزفری بلوتوثی مدل Level 2,۲,"۳۲۵,۹۹۰"
904,هندزفری بلوتوثی باسئوس مدل S06-NGS06,-1,"۶۹۵,۲۰۰"
905,هندزفری بلوتوثی مدل ایرپادpro3 New,۱,"۳۷۰,۰۰۰"
906,هندزفری بلوتوثی مدل ارداتس پرو3نیوز,۲.۷,"۳۹۰,۰۰۰"
907,هندزفری بلوتوثی یسیدو مدل YSP06,۱.۵,"۴۸۴,۱۰۰"
