,name,rate,price
1538,هدفون بلوتوثی مدل Beats STN-13,۲.۷,"۳۷۰,۰۰۰"
1539,هدفون بلوتوثی هوآوی مدل SEP 4I FREE BUDS FJV 2022 NEWU,-1,"۳,۷۳۶,۷۲۰"
1540,هدفون بلوتوثی کی تی مدل T7,۴.۱,"۵۴۹,۰۰۰"
1541,هدفون بلوتوثی مدل AirPods 2 (2nd Gen)Wireless,۳.۶,"۳۴۵,۰۰۰"
1542,هدفون بلوتوثی مدل Airpods Pro 2021,۳.۴,"۳۹۵,۰۰۰"
1543,هدست بلوتوثی جی بی ال مدل ASH NEW HEADSET TUNE 510 BT 2022,-1,"۱,۹۶۸,۰۰۰"
1544,هدست مخصوص بازی بلوتوثی مدل M33,۳,"۳۸۰,۰۰۰"
1545,هدست مخصوص بازی بلوتوثی ریزر مدل Opus X,-1,"۳,۵۳۰,۰۰۰"
1546,هدفون مخصوص بازی بلوتوثی شیائومی مدل RES NEW AIRDOTS 3 BUDS ANC,-1,"۶۵۰,۰۰۰"
1547,هدست بلوتوثی ریلمی مدل R2,۵,"۱۱۶,۰۰۰"
1548,هدست بلوتوثی هایلو مدل YAM GAMING W1 EARBUDSNEW,-1,"۱,۲۹۷,۰۰۰"
1549,هدفون بلوتوثی مدل Galaxy Buds Plus 2021,۳.۵,"۵۴۷,۰۰۰"
1550,هدست مخصوص بازی بلوتوثی هایلو مدل NBA MELOBUDS X1 PRO GLOBAL CONDUCTION,-1,"۲,۳۰۰,۰۰۰"
1551,هدست مخصوص بازی بلوتوثی شیائومی مدل MAH EARBUDS BUDS3 LITE SPORT,۱,"۱,۱۰۰,۰۰۰"
1552,هدست بلوتوثی هایلو مدل NIB BLUETOOTH T16 ANC PRO 2022,-1,"۲,۵۶۵,۸۸۰"
1553,هدفون بلوتوثی کی تی مدل X2,۴,"۲۶۹,۰۰۰"
1554,هدفون بلوتوثی کیو سی وای مدل DIY REDUCTION T17 GLOBAL BUDS,-1,"۵۹۰,۰۰۰"
1555,هدست بلوتوثی مدل AirPods Pro,۳.۵,"۴۰۰,۰۰۰"
1556,هدفون بلوتوثی مدل PRO12,۱.۲,"۱۹۲,۰۰۰"
1557,هدست بلوتوثی کیو سی وای مدل ASU EARPHONE T13 GLOBAL HANGING,۳,"۶۵۰,۰۰۰"
1558,هدفون بلوتوثی شیائومی مدل FAM SEMI AIR 2SE IN EAR,-1,"۱,۴۹۶,۰۰۰"
1559,هدفون بلوتوثی آکو مدل AT-1,۴,"۹۰۰,۰۰۰"
1560,هدفون بلوتوثی مدل گربه,-1,"۵۳۰,۰۰۰"
1561,هدست بلوتوثی مدل Air Pods Pro,-1,"۶۴۵,۰۰۰"
1562,هدفون بلوتوثی مدل Air12-EARPHONE,۳.۶,"۲۹۹,۰۰۰"
1563,هدست بلوتوثی شیائومی مدل SEY HIGH Q 2022 AIR 2 SE,۴,"۱,۴۸۹,۸۶۰"
1564,هدفون بلوتوثی میفا مدل x181,۳.۳,"۸۴۵,۰۰۰"
1565,هدست مخصوص بازی بلوتوثی اونیکوما مدل T23,۴,"۶۱۰,۰۰۰"
1566,هدست بلوتوثی نوکیا مدل E1200,۴.۵,"۱,۸۲۹,۰۰۰"
1567,هدفون مخصوص بازی بلوتوثی اونیکوما مدل B3,۴.۷,"۱,۲۰۰,۰۰۰"
1568,هدفون بلوتوثی مدل گربه,-1,"۵۳۰,۰۰۰"
1569,هدست بلوتوثی مدل Air Pods Pro,-1,"۶۴۵,۰۰۰"
1570,هدفون بلوتوثی جی بی ال مدل EMD 2022 Endurance TWSCD DIVE,-1,"۵,۴۴۵,۴۴۰"
1571,هدفون بلوتوثی نیا مدل NIA Q9,-1,"۵۸۰,۰۰۰"
1572,هدفون بلوتوثی هوآوی مدل SEP 4I FREE BUDS FJV 2022 NEWU,-1,"۳,۷۳۶,۷۲۰"
1573,هدفون بلوتوثی کی تی مدل T7,۴.۱,"۵۴۹,۰۰۰"
1574,هدفون بلوتوثی طرح گربه ای مدل KT-59 MICKY,-1,"۶۷۲,۰۰۰"
1575,هدفون بلوتوثی زیلوت مدل B20,۴,"۵۹۰,۰۰۰"
1576,هدفون بلوتوثی ام پی بلبری مدل BLB-156,-1,"۵۹۵,۰۰۰"
1577,هدفون بلوتوثی موتورولا مدل Motorola Verve Loop 105,۴,"۹۵۰,۰۰۰"
1578,هدفون بلوتوثی مدل Beats STN-13,۲.۷,"۳۷۰,۰۰۰"
1579,هدفون بلوتوثی ای کی جی مدل N200 NC,۱.۷,"۵۹۹,۰۰۰"
1580,هدست بلوتوثی گردنی اُ تو پلاس مدل OT-050,۵,"۲۶۶,۰۰۰"
1581,هدفون بلوتوثی نیا مدل Q8-NEW کد 001,۴.۷,"۲۷۵,۰۰۰"
1582,هدفون بلوتوثی هوآوی مدل SEP 4I FREE BUDS FJV 2022 NEWU,-1,"۳,۷۳۶,۷۲۰"
1583,هدفون بلوتوثی کی تی مدل T7,۴.۱,"۵۴۹,۰۰۰"
1584,هدفون مخصوص بازی بلوتوثی پرودو  مدل PDX412,۴.۴,"۷۰۰,۰۰۰"
1585,هدفون بلوتوثی زیلوت مدل B19,۴.۱,"۸۵۰,۰۰۰"
1586,هدست بلوتوثی گردنی اُ تو پلاس مدل OT-050,۵,"۲۶۶,۰۰۰"
1587,هدفون بلوتوثی مدل F9-39,۳.۷,"۹۳۰,۰۰۰"
1588,هدفون بلوتوثی شیائومی مدل SEY EARPHONE 2021 NEW 2 BASIC,-1,"۱,۴۱۹,۲۱۰"
1589,هدفون بلوتوثی مدل گربه ای PM,۳.۵,"۵۰۰,۰۰۰"
1590,هدست بلوتوثی مدل یونیکورن j34,-1,"۳۸۵,۰۰۰"
1591,هدفون بلوتوثی مدل STN-99,۴.۸,"۷۲۰,۰۰۰"
1592,هدفون بلوتوثی زیلوت مدل B20,۴,"۵۹۰,۰۰۰"
1593,هدست بلوتوثی تسکو مدل TH 5345,۴.۲,"۴۵۱,۰۰۰"
1594,هدفون بلوتوثی باسئوس مدل EMD Encok Vehicle-mounted NGA05-02 A05 Wireless Earphones NGA05-01,۳,"۳۳۰,۰۰۰"
1595,هدست بلوتوثی مدل Airpad کد pro5,۱,"۵۲۰,۰۰۰"
1596,هدست بلوتوثی مدل AirPods Pro,۱.۲,"۴۸۴,۰۰۰"
1597,هدفون بلوتوثی مدل KJ10,۲.۹,"۲۴۹,۵۰۰"
1598,هدست بلوتوثی هایلو مدل dye head seet gt6 hi-fi,-1,"۹۲۰,۰۲۰"
1599,هدست بلوتوثی هوکو مدل EW03 PLUS,-1,"۹۱۵,۰۰۰"
1600,هدفون بلوتوثی باسئوس مدل Encok W11,۵,"۱,۲۰۰,۰۰۰"
1601,هدفون بلوتوثی مدل M12 TWS,-1,"۸۹۰,۰۰۰"
1602,هدفون بلوتوثی شیائومی مدل FAM SEMI AIR 2SE IN EAR,-1,"۱,۴۹۶,۰۰۰"
1603,هدفون بلوتوثی سونی مدل LHA HEADPHONE CH510 TRUE WIRLESS 2021,-1,"۲,۴۹۱,۴۲۰"
1604,هدفون بلوتوثی شیائومی مدل SEY EARPHONE 2021 NEW 2 BASIC,-1,"۱,۴۱۹,۲۱۰"
1605,هدست بلوتوثی مدل یونیکورن j34,-1,"۳۸۵,۰۰۰"
1606,هدفون بلوتوثی ریمکس مدل RB- 700HB,۳,"۸۲۷,۶۴۰"
1607,هدست بلوتوثی هوآوی مدل PID NECKBAND FREELACE SPORT,۴,"۲,۴۶۴,۴۱۰"
1608,هدفون بلوتوثی رسی مدل REP-W18,-1,"۱,۱۴۰,۰۰۰"
1609,هدست بلوتوثی مدل AirPods Pro,۱.۲,"۴۸۴,۰۰۰"
1610,هدفون بلوتوثی مدل KJ10,۲.۹,"۲۴۹,۵۰۰"
1611,هدفون بلوتوثی جی بی ال مدل YAM tour pro PLAS NEW 2022,-1,"۶,۸۰۰,۰۰۰"
1612,هدفون بلوتوثی مدل STN-28 طرح Cat,۴,"۴۷۲,۳۴۰"
1613,هدفون بلوتوثی مدل P9,۳.۴,"۲۴۰,۰۰۰"
1614,هدست بلوتوثی هوکو مدل EW03 PLUS,-1,"۹۱۵,۰۰۰"
1615,هدفون بلوتوثی ریلمی مدل Realme Buds Wireless 2 Neo,۲.۵,"۷۹۵,۰۰۰"
1616,هدفون بلوتوثی مدل Airpods 3 2021,۳.۴,"۳۵۰,۰۰۰"
1617,هدفون بلوتوثی ارایمو کد 021547,۱,"۱,۰۰۰,۰۰۰"
1618,هدفون بلوتوثی ای کی جی مدل Y 500,۲.۵,"۴,۶۰۰,۰۰۰"
1619,هدست مخصوص بازی بلوتوثی هایلو مدل EMA ACF T15 POWERFULL,-1,"۸۱۹,۰۰۰"
1620,هدست بلوتوثی مک دودو مدل HP-8031,۵,"۷۲۰,۰۰۰"
1621,هدفون بلوتوثی شیائومی مدل SEP TWS BUDS 3 PRO GLOBAL,-1,"۳,۱۰۰,۰۰۰"
1622,هدست بلوتوثی شیائومی مدل dye melobuds earphone 2 pro anc,-1,"۲,۶۲۰,۰۰۰"
1623,هدفون بلوتوثی سودو مدل SD-1010,۴,"۳۸۴,۰۰۰"
1624,هدفون بلوتوثی لنوو مدل HT06,-1,"۳۴۵,۰۰۰"
1625,هدست بلوتوثی شیائومی مدل NBA WIRLESS AIRDOTS 3 GLOBAL SPORT,۱,"۶۵۰,۰۰۰"
1626,هدفون بلوتوثی مویان مدل MY-210,۳.۹,"۱۹۸,۰۰۰"
1627,هدفون بلوتوثی مدل AirPods Pro Anc high,۳.۲,"۴۰۰,۰۰۰"
1628,هدفون بلوتوثی انرجایزر مدل UB2605,۴.۱,"۱,۴۵۰,۰۰۰"
1629,هدفون بلوتوثی مدل P16,۴,"۲۰۸,۹۰۰"
1630,هدفون بلوتوثی پرووان مدل Moco (PHB3505),۳.۸,"۵۲۹,۰۰۰"
1631,هدفون بلوتوثی مدلBK1 طرح گوش گربه ای,۵,"۱,۴۰۰,۰۰۰"
1632,هدفون بلوتوثی هوآوی مدل DEH BAND NACK FREELACE 2021,۴.۵,"۲,۱۷۴,۰۰۰"
1633,هدفون بلوتوثی مدل BK1 طرح گوش گربه ای,-1,"۱,۰۸۰,۰۰۰"
1634,هدفون بلوتوثی لنوو مدل SAE Lods LP1S ss Blueh,۳.۹,"۴۳۵,۰۰۰"
1635,هدست بلوتوثی هاینو تکو مدل POP 2030 Pro GOLD EDITION,۳,"۶۲۰,۰۰۰"
1636,هدست بلوتوثی کیو سی وای مدل FTI BUDS T19 2022,-1,"۸۷۵,۰۰۰"
1637,هدفون بلوتوثی سودو مدل MH13,۳.۹,"۵۳۵,۰۰۰"
1638,هدست مخصوص بازی بلوتوثی جی بی ال مدل FAR SPDJR Tune 205 BT,-1,"۹۴۰,۰۰۰"
1639,هدفون بلوتوثی آرسون مدل TWS-T9S,۳.۹,"۳۴۹,۰۰۰"
1640,هدست بلوتوثی سودو مدل SD-1009 NEW,-1,"۵۸۰,۰۰۰"
1641,هدفون بلوتوثی مدل F9-43,۳.۶,"۴۸۴,۵۰۰"
1642,هدفون بلوتوثی شیائومی مدل dye earbuds air2se gaming,-1,"۱,۴۹۲,۱۸۰"
1643,هدست بلوتوثی جی بی ال مدل ERF SOUND 215 EQB TUNE,-1,"۲,۹۶۸,۰۰۰"
1644,هدست بلوتوثی آکی مدل EP-B52 V2,۴.۵,"۱,۳۶۲,۷۶۰"
1645,هدفون بلوتوثی ریمکس مدل RB- 700HB,۳,"۸۲۷,۶۴۰"
1646,هدست بلوتوثی جی بی ال مدل Air-R03,۲.۵,"۳۹۹,۰۰۰"
1647,هدست بلوتوثی هایلو مدل DEH RANGE HIGH GT6 2020,-1,"۶۷۰,۰۰۰"
1648,هدست بلوتوثی هوکو مدل EW05 PLUS PRO,-1,"۱,۲۸۸,۰۰۰"
1649,هدفون بلوتوثی باسئوس مدل NAS SIMU S2 5.0 TWS wireless Bluetooth earphones,-1,"۲,۰۵۰,۰۰۰"
1650,هدست مخصوص بازی بلوتوثی کیو سی وای مدل EHM HEADSET T5 VERSION 2022,-1,"۱,۰۶۰,۰۰۰"
1651,هدفون بلوتوثی مدل P9,۳.۴,"۲۴۰,۰۰۰"
1652,هدست بلوتوثی آکو مدل AH-300,۳.۷,"۸۵۰,۰۰۰"
1653,هدفون بلوتوثی اسکال کندی مدل Sesh Evo S2TVW-N896,۴.۸,"۳,۳۰۰,۰۰۰"
1654,هدفون بلوتوثی کیو سی وای مدل MID ERAPHONE T5 GLOBAL ULTRA,-1,"۷۲۰,۰۱۰"
1655,هدفون بلوتوثی ای کی جی مدل Y 500,۲.۵,"۴,۶۰۰,۰۰۰"
1656,هدست بلوتوثی مدل Galaxy Buds2,-1,"۴۴۲,۰۰۰"
1657,هدفون بلوتوثی فیلیپس مدل TAH 4205,۲.۵,"۲,۸۰۰,۰۰۰"
1658,هدفون بلوتوثی کیو سی وای مدل MOB EARPHON HT03NEW BLUETOOTH,-1,"۱,۹۸۵,۵۵۰"
1659,هدفون مخصوص بازی بلوتوثی شیائومی مدل MRE EARPHONE 2 PRO AMBIENT AWARE STEREOO,۱,"۲,۶۱۲,۰۰۰"
1660,هدفون مخصوص بازی بلوتوثی کیو سی وای مدل HGS ADJUST T17 S ANC 2022,-1,"۱,۲۰۰,۰۰۰"
1661,هدست بلوتوثی کیو سی وای مدل LHA EARPHONE T18 WIRLESS APTX 2022,-1,"۱,۴۲۵,۰۰۰"
1662,هدست بلوتوثی سودو مدل SD-1009 NEW,-1,"۵۸۰,۰۰۰"
1663,هدفون بلوتوثی لنوو مدل POR 05X 2020 HE,۳.۶,"۹۵۰,۰۰۰"
1664,هدست مخصوص بازی بلوتوثی مدل AH LEVEL U 2 ACTIVE 2021,۲.۵,"۶۲۳,۰۰۰"
1665,هدست بلوتوثی مدل AirPods Pro,-1,"۱,۹۵۰,۰۰۰"
1666,هدفون بلوتوثی مدل BK1 طرح گوش گربه ای,-1,"۱,۰۸۰,۰۰۰"
1667,هدفون بلوتوثی ترانیو مدل خلبانی,-1,"۲۹۸,۵۱۰"
1668,هدست بلوتوثی مدل AirPods Pro,۴.۵,"۳۹۹,۰۰۰"
1669,هدست بلوتوثی کی تی مدل JB950,۳.۷,"۳۱۰,۰۰۰"
1670,هدست بلوتوثی مارشال مدل Monitor II ANC,۳,"۱۲,۵۰۰,۰۰۰"
1671,هدفون بلوتوثی مدل CAT EAR کد P33M,۴,"۳۴۱,۸۵۰"
1672,هدست بلوتوثی شیائومی مدل NBA WIRLESS AIRDOTS 3 GLOBAL SPORT,۱,"۶۵۰,۰۰۰"
1673,هدست بلوتوثی کیو سی وای مدل FTI BUDS T19 2022,-1,"۸۷۵,۰۰۰"
1674,هدفون بلوتوثی هایلو مدل SHO EDITION X1 PRO VERSION,۴,"۱,۸۸۵,۸۰۰"
1675,هدفون بلوتوثی آرسون مدل TWS-T9S,۳.۹,"۳۴۹,۰۰۰"
1676,هدفون بلوتوثی جی بی ال مدل RIK UNDER 2022 FLASH X,-1,"۷,۸۴۰,۵۴۰"
1677,هدفون بلوتوثی مدل F9-43,۳.۶,"۴۸۴,۵۰۰"
1678,هدست بلوتوثی هایلو مدل SAG EARPHONE GT6 GLOBAL ANC,-1,"۹۹۱,۰۰۰"
1679,هدفون بلوتوثی جی بی ال مدل FRD LIVE PRO PLUS TWS 2022 GLOBAL,-1,"۵,۵۶۷,۹۱۰"
1680,هدفون بلوتوثی جی بی ال مدل FRD ENDURANCE DIVE 2022 NER,-1,"۵,۲۳۲,۳۱۰"
1681,هدفون بلوتوثی مدلBK1 طرح گوش گربه ای,۵,"۱,۴۰۰,۰۰۰"
1682,هدفون بلوتوثی باسئوس مدل NAS SIMU S2 5.0 TWS wireless Bluetooth earphones,-1,"۲,۰۵۰,۰۰۰"
1683,هدست بلوتوثی مدل neckband earphones basic,۳.۸,"۱۸۸,۰۰۰"
1684,هدست مخصوص بازی بلوتوثی کیو سی وای مدل EHM HEADSET T5 VERSION 2022,-1,"۱,۰۶۰,۰۰۰"
1685,هدفون بلوتوثی جی بی ال مدل SAE Live Free NC+ TWS True,۵,"۲,۸۹۰,۰۰۰"
1686,هدفون بلوتوثی جی بی ال مدل RKB REDUCTION TOUR PRO PLUS GLOBAL 2021,-1,"۷,۲۳۶,۱۲۰"
1687,هدفون بلوتوثی فیلیپس مدل TAH 4205,۲.۵,"۲,۸۰۰,۰۰۰"
1688,هدفون مخصوص بازی بلوتوثی کیو سی وای مدل HGS ADJUST T17 S ANC 2022,-1,"۱,۲۰۰,۰۰۰"
1689,هدست مخصوص بازی بلوتوثی مدل YX-01,۳.۹,"۴۴۰,۰۰۰"
1690,هدفون مخصوص بازی بلوتوثی لنوو مدل ES204,۲.۸,"۱۵۰,۰۰۰"
1691,هدفون بلوتوثی مدل ASE WIRLESS AIRDOTS 3 GLOBAL TWS,۵,"۱,۸۰۱,۹۲۰"
1692,هدست بلوتوثی سودو مدل SD-1009 NEW,-1,"۵۸۰,۰۰۰"
1693,هدفون بلوتوثی پرووان مدل Moco (PHB3505),۳.۸,"۵۲۹,۰۰۰"
1694,هدفون بلوتوثی لنوو مدل POR 05X 2020 HE,۳.۶,"۹۵۰,۰۰۰"
1695,هدفون بلوتوثی هوآوی مدل DEH BAND NACK FREELACE 2021,۴.۵,"۲,۱۷۴,۰۰۰"
1696,هدست بلوتوثی مارشال مدل Monitor II ANC,۳,"۱۲,۵۰۰,۰۰۰"
1697,هدست بلوتوثی هایلو مدل ham head phon gt7 anc,-1,"۸۹۴,۲۰۰"
1698,هدفون مخصوص بازی بلوتوثی اوی مدل SAE T15 tws Waterproof,-1,"۱,۲۲۰,۰۰۰"
1699,هدفون بلوتوثی مدل A30s,۴.۲,"۵۴۰,۰۰۰"
1700,هدست مخصوص بازی بلوتوثی شیائومی مدل EMD ANC AIRDOTS 3 BTWS,۱,"۶۳۲,۱۹۰"
1701,هدفون مخصوص بازی بلوتوثی سونی مدل DAS OVER EAR CH510 HEADSET 2022,-1,"۲,۴۵۴,۴۴۰"
1702,هدفون مخصوص بازی بلوتوثی اوی مدل SAE T15 tws Waterproof,-1,"۱,۲۲۰,۰۰۰"
1703,هدفون بلوتوثی مدل A30s,۴.۲,"۵۴۰,۰۰۰"
1704,هدفون بلوتوثی سونی مدل MHA 510 WL ZTE EARPHONE,-1,"۳,۵۵۷,۳۳۰"
1705,هدست بلوتوثی مدل Airpods pro A2084,۵,"۴۶۴,۰۰۰"
1706,هدفون بلوتوثی کی تی مدل X1,۴,"۲۷۳,۰۰۰"
1707,هدست بلوتوثی لنیز مدل Air 38,۱,"۷۰۰,۰۰۰"
1708,هدفون بلوتوثی شیائومی مدل dye earbuds air2se gaming,-1,"۱,۴۹۲,۱۸۰"
1709,هدفون بلوتوثی مدل TWS-M12,۳,"۴۹۹,۰۰۰"
1710,هدفون بلوتوثی کی تی مدل PROBASS 3,۴.۱,"۴۴۵,۰۰۰"
1711,هدست بلوتوثی جی بی ال مدل Air-R03,۲.۵,"۳۹۹,۰۰۰"
1712,هدفون بلوتوثی باسئوس مدل NAS SIMU S2 5.0 TWS wireless Bluetooth earphones,-1,"۲,۰۵۰,۰۰۰"
1713,هدست بلوتوثی جی بی ال مدل EMD TOUR 2022 PRO BT0.5 PLUS TWS ANC,-1,"۶,۳۰۸,۱۲۰"
1714,هدفون مخصوص بازی بلوتوثی هایلو مدل OLA NEW BEST GT7 2021,-1,"۸۰۰,۰۰۰"
1715,هدست بلوتوثی لنوو مدل XG02,۴.۳,"۵۸۰,۰۰۰"
1716,هدفون بلوتوثی هایلو مدل NIB BUDS NEW T15 WIRLESS,-1,"۱,۳۹۵,۰۰۰"
1717,هدفون بلوتوثی ریمکس مدل RB- 700HB,۳,"۸۲۷,۶۴۰"
1718,هدفون مخصوص بازی بلوتوثی سونی مدل NAS 510 VFR SP 2022,-1,"۳,۵۱۴,۶۱۰"
1719,هدست بلوتوثی او ام تینگ مدل MOH Airfree EO002BT TWS 4 ENC Mic,۱,"۱,۰۹۹,۹۹۰"
1720,هدفون بلوتوثی لنوو مدل MARY HE05X 2021 LPOF,۳.۴,"۲۳۸,۰۰۰"
1721,هدفون بلوتوثی مدل P9,۳.۴,"۲۴۰,۰۰۰"
1722,هدست بلوتوثی لنوو مدل XG02,۴.۳,"۵۸۰,۰۰۰"
1723,هدست بلوتوثی مدل AirPods Pro,۱.۲,"۴۸۴,۰۰۰"
1724,هدفون بلوتوثی مدل KJ10,۲.۹,"۲۴۹,۵۰۰"
1725,هدست بلوتوثی شیائومی مدل dye melobuds earphone 2 pro anc,-1,"۲,۶۲۰,۰۰۰"
1726,هدست بلوتوثی هوکو مدل EW03 PLUS,-1,"۹۱۵,۰۰۰"
1727,هدفون بلوتوثی سودو مدل SD-1010,۴,"۳۸۴,۰۰۰"
1728,هدست بلوتوثی ریسدین مدل RBT10,-1,"۲۹۹,۰۰۰"
1729,هدست بلوتوثی او ام تینگ مدل MOH Airfree EO002BT TWS 4 ENC Mic,۱,"۱,۰۹۹,۹۹۰"
1730,هدفون بلوتوثی ریمکس مدل TWS-29,۱,"۷۹۰,۲۰۰"
1731,هدفون بلوتوثی ارایمو کد 021547,۱,"۱,۰۰۰,۰۰۰"
1732,هدفون بلوتوثی مویان مدل MY-210,۳.۹,"۱۹۸,۰۰۰"
1733,هدفون بلوتوثی جی بی ال مدل RKB REDUCTION TOUR PRO PLUS GLOBAL 2021,-1,"۷,۲۳۶,۱۲۰"
1734,هدفون بلوتوثی مدل AirPods Pro Anc high,۳.۲,"۴۰۰,۰۰۰"
1735,هدست بلوتوثی رسی مدل REP-W21,-1,"۱,۵۷۰,۰۰۰"
1736,هدفون بلوتوثی سونی مدل YAM SP 510 BT ANC NEW TWS,-1,"۳,۵۴۶,۶۵۰"
1737,هدست مخصوص بازی بلوتوثی مک دودو مدل HP-803,-1,"۷۹۸,۶۹۰"
1738,هدست مخصوص بازی بلوتوثی مدل YX-01,۳.۹,"۴۴۰,۰۰۰"
1739,هدست بلوتوثی هاینو تکو مدل Air 1 mini,۴.۵,"۵۶۰,۰۰۰"
1740,هدفون بلوتوثی لنوو مدل XT91 2021,۳.۹,"۴۵۷,۰۰۰"
1741,هدفون بلوتوثی مدل ASE WIRLESS AIRDOTS 3 GLOBAL TWS,۵,"۱,۸۰۱,۹۲۰"
1742,هدفون بلوتوثی هوکو مدل ES51,۴.۵,"۳۹۰,۰۰۰"
1743,هدست بلوتوثی لنوو مدل XG02,۴.۳,"۵۸۰,۰۰۰"
1744,هدفون بلوتوثی ادیفایر مدل SEP 2022 TWS1 GORIUDS,-1,"۱,۰۷۵,۰۰۰"
1745,هدست بلوتوثی انکر مدل SoundCore Life 2 Neo,۴.۸,"۲,۴۸۵,۰۰۰"
1746,هدست مخصوص بازی بلوتوثی کیو سی وای مدل DYE CONDUCTION T5 TURE,۵,"۶۷۴,۹۹۰"
1747,هدست بلوتوثی سودو مدل sd-704,۵,"۲۷۴,۸۵۰"
1748,هدست بلوتوثی جی بی ال مدل MAH PEAK 2 NOISE CANCELLATION,-1,"۴,۴۲۹,۵۳۰"
1749,هدفون مخصوص بازی بلوتوثی جی بی ال مدل ZHE TUNE ROTATING 710 BLUETOOTH,-1,"۳,۹۰۰,۰۰۰"
1750,هدست بلوتوثی او ام تینگ مدل MOH Airfree EO002BT TWS 4 ENC Mic,۱,"۱,۰۹۹,۹۹۰"
1751,هدفون بلوتوثی مدل Buds live,۳.۳,"۵۸۰,۰۰۰"
1752,هدست بلوتوثی باسئوس مدل NGD PRO,۴,"۸۶۳,۹۱۰"
1753,هدست بلوتوثی پرووان مدل SR10,۳.۴,"۳۵۹,۰۰۰"
1754,هدست مخصوص بازی بلوتوثی مک دودو مدل HP-803,-1,"۷۹۸,۶۹۰"
1755,هدفون بلوتوثی جی بی ال مدل RKB REDUCTION TOUR PRO PLUS GLOBAL 2021,-1,"۷,۲۳۶,۱۲۰"
1756,هدفون بلوتوثی فیلیپس مدل TAPH805,-1,"۶,۵۹۰,۰۰۰"
1757,هدفون بلوتوثی جووی مدل H172,-1,"۱,۰۲۰,۰۰۰"
1758,هدست مخصوص بازی بلوتوثی مدل YX-01,۳.۹,"۴۴۰,۰۰۰"
1759,هدفون بلوتوثی مدل P39,۳.۷,"۲۳۰,۰۰۰"
1760,هدفون بلوتوثی مدل STN-28 طرح Cat,۳.۷,"۴۴۱,۴۲۰"
1761,هدست بلوتوثی آکو مدل Rock HROCK02,۴,"۸۴۰,۰۰۰"
1762,هدفون بلوتوثی یوسمز مدل YX05,۴.۷,"۱,۱۳۹,۰۰۰"
1763,هدفون بلوتوثی ایکس پی-پروداکت مدل HS944F,۳,"۳۹۰,۰۰۰"
1764,هدفون بلوتوثی کی تی مدل X1,۴,"۲۷۳,۰۰۰"
1765,هدفون بلوتوثی مدل yx-39,۳.۵,"۱۸۰,۰۰۰"
1766,هدست بلوتوثی مدل AirPods Pro,۴.۵,"۳۹۹,۰۰۰"
1767,هدفون بلوتوثی لیتو مدل L-20,-1,"۸۸۴,۰۰۰"
1768,هدفون بلوتوثی مدل CAT EAR کد P33M,۴,"۳۴۱,۸۵۰"
1769,هدفون مخصوص بازی بلوتوثی باسئوس مدل  E9,-1,"۲,۸۸۳,۶۰۰"
1770,هدفون بلوتوثی جی بی ال مدل JR 460NC,۵,"۳,۴۷۰,۰۰۰"
1771,هدفون بلوتوثی جی بی ال مدل RIK UNDER 2022 FLASH X,-1,"۷,۸۴۰,۵۴۰"
1772,هدفون بلوتوثی باوین مدل 08,۴.۳,"۹۹۹,۸۰۰"
1773,هدفون بلوتوثی مدل G40,۲.۷,"۶۹۹,۰۰۰"
1774,هدست بلوتوثی شیائومی مدل NBA BLUETOOTH BUDS 3 PRO POWER PLANT,-1,"۳,۸۱۷,۰۰۰"
1775,هدفون بلوتوثی باسئوس مدل SIMU S2,-1,"۱,۹۹۹,۰۰۰"
1776,هدفون مخصوص بازی بلوتوثی سونی مدل NAS 510 VFR SP 2022,-1,"۳,۵۱۴,۶۱۰"
1777,هدفون بلوتوثی جی بی ال مدل FRD ENDURANCE DIVE 2022 NER,-1,"۵,۲۳۲,۳۱۰"
1778,هدفون بلوتوثی ترانیو مدل T-M15,۴.۴,"۳۶۸,۰۰۰"
1779,هدفون بلوتوثی لنوو مدل MARY HE05X 2021 LPOF,۳.۴,"۲۳۸,۰۰۰"
1780,هدفون بلوتوثی اوی مدل T55,۳.۸,"۷۲۰,۰۰۰"
1781,هدست بلوتوثی کیو سی وای مدل ROK NEW T10 PRO FREQUENCY,۴,"۱,۰۰۰,۰۰۰"
1782,هدفون بلوتوثی جووی مدل H180,-1,"۷۵۰,۰۰۰"
1783,هدفون مخصوص بازی بلوتوثی باسئوس مدل DEH NECKBAND BOWIE P1 2022,-1,"۸۹۰,۷۰۰"
1784,هدفون بلوتوثی رسی مدل G50,-1,"۱,۰۸۵,۰۰۰"
1785,هدست بلوتوثی ریسدین مدل RBT10,-1,"۲۹۹,۰۰۰"
1786,هدفون بلوتوثی مدل Buds live,۳.۳,"۵۸۰,۰۰۰"
1787,هدفون بلوتوثی ریمکس مدل TWS-29,۱,"۷۹۰,۲۰۰"
1788,هدفون بلوتوثی لنوو مدل EFM QT82,۳.۸,"۶۰۰,۰۰۰"
1789,هدست بلوتوثی مدل cat ear b39m,۵,"۴۴۶,۴۰۰"
1790,هدست بلوتوثی رسی مدل REP-W21,-1,"۱,۵۷۰,۰۰۰"
1791,هدفون بلوتوثی سونی مدل YAM SP 510 BT ANC NEW TWS,-1,"۳,۵۴۶,۶۵۰"
1792,هدفون بلوتوثی شیائومی مدل SEP EARPHONE 2S GLOBAL 2022,۱,"۲,۲۱۱,۰۲۰"
1793,هدفون بلوتوثی مدل yx-39,۳.۵,"۱۸۰,۰۰۰"
1794,هدفون بلوتوثی لیتو مدل L-20,-1,"۸۸۴,۰۰۰"
1795,هدست بلوتوثی اچ‌پی مدل H1WPRO,۵,"۵۹۹,۰۰۰"
1796,هدفون مخصوص بازی بلوتوثی لنوو مدل EMD Bluetooth Headphones HD200 Microphone,-1,"۱,۴۲۷,۷۹۰"
1797,هدست بلوتوثی جی بی ال مدل HSA HIGH FREQUENCY FLASH X ARMOUR,-1,"۷,۸۱۲,۰۰۰"
1798,هدست بلوتوثی شیائومی مدل NBA BLUETOOTH BUDS 3 PRO POWER PLANT,-1,"۳,۸۱۷,۰۰۰"
1799,هدفون بلوتوثی پرووان مدل Mirra Series,۴.۱,"۶۵۷,۰۰۰"
1800,هدست بلوتوثی مدل TCW01-A Pro,۵,"۳,۲۹۴,۶۰۰"
1801,هدفون بلوتوثی هایلو مدل PID ANC GT5 MELOBUDS,-1,"۱,۴۰۹,۷۶۰"
1802,هدفون بلوتوثی جووی مدل H180,-1,"۷۵۰,۰۰۰"
1803,هدفون بلوتوثی پرووان مدل PHB3370,۳.۸,"۸۷۹,۰۰۰"
1804,هدفون بلوتوثی فیلیپس مدل TAPH805,-1,"۶,۵۹۰,۰۰۰"
1805,هدفون مخصوص بازی بلوتوثی باوین مدل BAVIN-20,-1,"۱,۷۲۸,۰۰۰"
1806,هدفون بلوتوثی جووی مدل H172,-1,"۱,۰۲۰,۰۰۰"
1807,هدست بلوتوثی لنوو مدل H16 Pro,۴.۵,"۸۷۰,۰۰۰"
1808,هدست بلوتوثی ریمکس مدل TWS-33,۳,"۱,۹۰۰,۰۰۰"
1809,هدست بلوتوثی یاماها مدل EP-E50A,-1,"۵,۳۰۰,۰۰۰"
1810,هدفون بلوتوثی مدل yx-39,۳.۵,"۱۸۰,۰۰۰"
1811,هدست بلوتوثی مدل MMD P33,-1,"۲۲۰,۰۰۰"
1812,هدفون بلوتوثی لیتو مدل L-20,-1,"۸۸۴,۰۰۰"
1813,هدفون بلوتوثی مدل STN-28 طرح Cat,۳.۷,"۴۴۱,۴۲۰"
1814,هدست بلوتوثی آکو مدل Rock HROCK02,۴,"۸۴۰,۰۰۰"
1815,هدفون بلوتوثی شیائومی مدل DAS EDITION EARPHON 2S HI-FI 2021,-1,"۲,۳۹۸,۵۴۰"
1816,هدفون بلوتوثی ادیفایر مدل SEP 2022 TWS1 GORIUDS,-1,"۱,۰۷۵,۰۰۰"
1817,هدست بلوتوثی کی تی مدل N65,۲,"۳۲۲,۰۰۰"
1818,هدست بلوتوثی جی بی ال مدل MAH PEAK 2 NOISE CANCELLATION,-1,"۴,۴۲۹,۵۳۰"
1819,هدست بلوتوثی شیائومی مدل NBA BLUETOOTH BUDS 3 PRO POWER PLANT,-1,"۳,۸۱۷,۰۰۰"
1820,هدفون مخصوص بازی بلوتوثی هایلو مدل ESN NEW TRUE WIRLEE GT6 EARBUDS,۵,"۸۵۱,۷۹۰"
1821,هدفون بلوتوثی کی تی مدل Flex,۳.۶,"۲۹۹,۰۰۰"
1822,هدفون بلوتوثی مدل TWS MD158,-1,"۱,۲۰۰,۰۰۰"
1823,هدفون مخصوص بازی بلوتوثی باسئوس مدل DEH NECKBAND BOWIE P1 2022,-1,"۸۹۰,۷۰۰"
1824,هدفون بلوتوثی رسی مدل G50,-1,"۱,۰۸۵,۰۰۰"
1825,هدست بلوتوثی آدیو-تکنیکا مدل ATH-M20xBT,-1,"۳,۹۸۰,۰۰۰"
1826,هدفون بلوتوثی وان مور مدل JP-AB PISTON FIT E1028,۴.۳,"۱,۰۳۵,۰۰۰"
1827,هدفون بلوتوثی لنوو مدل EFM QT82,۳.۸,"۶۰۰,۰۰۰"
1828,هدست بلوتوثی مدل cat ear b39m,۵,"۴۴۶,۴۰۰"
1829,هدست مخصوص بازی بلوتوثی لنوو مدل SHO THINKPLUS H15 PRO TWS,-1,"۱,۶۰۰,۰۰۰"
1830,هدست مخصوص بازی بلوتوثی شیائومی مدل THI HEADPHONE AIR DOTS 3 GLOBAL LOW LATENCY,-1,"۶۵۰,۰۰۰"
1831,هدفون بلوتوثی باوین مدل 08,۴.۳,"۹۹۹,۸۰۰"
1832,هدفون بلوتوثی مدل G40,۲.۷,"۶۹۹,۰۰۰"
1833,هدفون بلوتوثی اسکال کندی مدل Vinyl,-1,"۲,۴۸۰,۰۰۰"
1834,هدفون بلوتوثی لنوو مدل RAG EARHOOK GLOBAL GM5 POWER PLANT,-1,"۷۴۰,۰۰۰"
